"","X","display_title","mpaa_rating","critics_pick","byline","headline","summary_short","publication_date","opening_date","date_updated","openingyear"
"1179",125,"Song from the Forest","",0,"JON CARAMANICA","Review: In ‘Song From the Forest,’ Louis Sarno Links Africa and America","A father-son relationship, music and the Bayaka of the Central African Republic are central to this documentary.","2015-04-09","2015-04-10","2017-11-02 4:18",2015
"1180",126,"Dior and I","R",0,"A. O. SCOTT","Review: ‘Dior and I,’ a Documentary That Peers Into a Storied Fashion House","This documentary largely takes place in 2012, when Dior&#8217;s legacy is placed in the hands of Raf Simons, who has just eight weeks to produce his first couture collection for the company.","2015-04-09","2015-04-10","2017-11-02 4:18",2015
"1181",127,"Broken Horses","R",0,"NICOLAS RAPOLD","Review: ‘Broken Horses,’ Vidhu Vinod Chopra’s Modern Western","Brotherly love and American cowboy-film conventions are interpreted here by an Indian director in an English-language film.","2015-04-09","2015-04-10","2017-11-02 4:18",2015
"1182",128,"Detective Byomkesh Bakshy","",0,"RACHEL SALTZ","Review: ‘Detective Byomkesh Bakshy!,’ a Calcutta Whodunit","The detective, who first appeared in the 1930s in stories by Saradindu Bandyopadhyay, tackles a mystery in a film by Dibakar Banerjee.","2015-04-05","2015-04-03","2017-11-02 4:18",2015
"1183",129,"Last Knights","R",0,"MANOHLA DARGIS","Review: ‘Last Knights’ Has Sword Swinging and Cape Twirling in the Name of Revenge","This medieval-esque potboiler has a simple code of devotion to one&#8217;s master, and mostly involves men, honor, vengeance, dramatic fights and the fantasy of the good death.","2015-04-02","2015-04-03","2017-11-02 4:18",2015
"1184",130,"Lambert & Stamp","R",0,"A. O. SCOTT","Review: ‘Lambert &amp; Stamp’ Recalls the Duo Who Helped Ignite the Who","In a mix of archival footage and interviews, this nostalgic documentary portrays an unlikely music-world partnership.","2015-04-02","2015-04-03","2017-11-02 4:18",2015
"1185",131,"The Girl Is In Trouble","",0,"JEANNETTE CATSOULIS","Review: In ‘The Girl Is in Trouble,’ a Pretty Face Masks Danger","A modern-day noir starring Columbus Short and Wilmer Valderrama focuses on how the tensions of immigration and gentrification have shaped the Lower East Side.","2015-04-02","2015-04-03","2017-11-02 4:18",2015
"1186",132,"Manos Sucias","",0,"JEANNETTE CATSOULIS","Review: In ‘Manos Sucias,’ Brothers Reconnect on a Drug Run","In this Josef Kubota Wladyka film, two Colombian brothers with a cargo of cocaine reconnect during a trip along the Pacific Coast.","2015-04-02","2015-04-03","2017-11-02 4:18",2015
"1187",133,"Furious 7","PG-13",0,"A. O. SCOTT","Review: In ‘Furious 7,’ a Franchise Continues to Roar","Lots of familiar faces and speed demons are back for the latest in the franchise.","2015-04-01","2015-04-03","2017-11-02 4:18",2015
"1188",134,"Woman in Gold","PG-13",0,"STEPHEN HOLDEN","Review: ‘Woman in Gold’ Stars Helen Mirren in Tug of War Over Artwork","This drama based on real-life traces the legal battle by Ms. Mirren&#8217;s character to regain possession of a priceless canvas stolen from her family by the Nazis 60 years earlier.","2015-03-31","2015-04-10","2017-11-02 4:18",2015
"1189",135,"While We're Young","R",1,"A. O. SCOTT","Review: In ‘While We’re Young,’ a Coupling of Gen X and Y","In Noah Baumbach&#8217;s film, Ben Stiller and Naomi Watts play a couple in their 40s who become captivated by a younger pair who seem to freely embrace experience.","2015-03-26","2015-04-17","2017-11-02 4:18",2015
"1190",136,"Danny Collins","R",0,"STEPHEN HOLDEN","Review: Al Pacino in ‘Danny Collins’ Plays a Dissolute Pop Star","In Dan Fogelman&#8217;s comic drama, a 40-year-old letter from John Lennon could change a jaded older singer&#8217;s life.","2015-03-19","2015-04-10","2017-11-02 4:18",2015
"1191",137,"Dreams Rewired","",0,"STEPHEN HOLDEN","Review: ‘Dreams Rewired,’ a Futuristic Look at the Past","This documentary fuses film clips from the 1880s to the 1930s, illustrating the human response to new technology.","2015-12-15","2015-05-01","2017-11-02 4:18",2015
"1192",138,"Uncertain Terms","",0,"NICOLAS RAPOLD","Review: ‘Uncertain Terms’ Enters a Home for Pregnant Young Women","In this film by Nathan Silver, an unhappily married handyman is dropped into an emotional maelstrom.","2015-05-29","2015-05-29","2017-11-02 4:18",2015
"1193",139,"Survivor","PG-13",0,"NEIL GENZLINGER","Review: In &#8216;Survivor,&#8217; a Thriller About Terrorism, Milla Jovovich Is on the Run","A security inquiry into visa requests leads to assassination attempts in this film directed by James McTeigue.","2015-05-29","2015-05-29","2017-11-02 4:18",2015
"1194",140,"Heaven Knows What","R",1,"NICOLAS RAPOLD","Review: &#8216;Heaven Knows What&#8217; Dramatizes a Young Junkie&#8217;s Life","Directed by Josh and Benny Safdie, &#8220;Heaven Knows What&#8221; chronicles an addict and her pursuits on the streets of New York.","2015-05-28","2015-05-29","2017-11-02 4:18",2015
"1195",141,"Unfreedom","",0,"JEANNETTE CATSOULIS","Review: ‘Unfreedom,’ a Raj Amit Kumar Tale of Sex, Religion and Tradition","Abduction, sexual orientation and violence are at the core of this drama.","2015-05-28","2015-05-29","2017-11-02 4:18",2015
"1196",142,"The True Cost","PG-13",0,"JEANNETTE CATSOULIS","Review: &#8216;The True Cost&#8217; Investigates High Price of Fashion Bargains","This documentary by Andrew Morgan details the exploitation of workers in garment factories and cotton fields around the world.","2015-05-28","2015-05-29","2017-11-02 4:18",2015
"1197",143,"San Andreas","PG-13",0,"A. O. SCOTT","Review: In ‘San Andreas,’ Dwayne Johnson Rushes to Rescue His Collapsing World","The big earthquake in this film has its pros and cons: On the one hand, tearing California asunder. On the other, bringing a family together.","2015-05-28","2015-05-29","2017-11-02 4:18",2015
"1198",144,"Aloha","PG-13",0,"A. O. SCOTT","Review: ‘Aloha,’ a Hangout Movie With Bradley Cooper and Emma Stone in Hawaii","Cameron Crowe’s loose and leisurely film can be enjoyed the way you enjoy a catch-up beer with an old friend you don’t have much in common with anymore.","2015-05-28","2015-05-29","2017-11-02 4:18",2015
"1199",145,"Tomorrowland","PG",0,"A. O. SCOTT","Review: &#8216;Tomorrowland,&#8217; Brad Bird&#8217;s Lesson in Optimism","There is nothing casual or whimsical about this movie&#8217;s celebration of hope, imagination and joy.","2015-05-21","2015-05-22","2017-11-02 4:18",2015
"1200",146,"Mita Tova","",0,"STEPHEN HOLDEN","Review: &#8216;The Farewell Party&#8217; Finds Laughs in Euthanasia","In Tal Granit and Sharon Maymon&#8217;s Israeli comedy, set at a Jerusalem retirement home, an amateur inventor devises a &#8220;mercy-killing machine.&#8221;","2015-05-21","2015-05-22","2017-11-02 4:18",2015
"1201",147,"Sunshine Superman","PG",0,"NEIL GENZLINGER","Review: &#8216;Sunshine Superman,&#8217; About the High-Flying Daredevil Carl Boenish","This documentary, directed by Marah Strauch, is a bittersweet take on a man who looked at very tall things and saw an opportunity to jump.","2015-05-21","2015-05-22","2017-11-02 4:18",2015
"1202",148,"Seeds of Time","",0,"NICOLAS RAPOLD","Review: &#8216;Seeds of Time,&#8217; a Documentary on a Crusader for Crop Diversity","The urgency of expanding the world&#8217;s seed portfolio is made eminently clear in this film directed by Sandy McLeod.","2015-05-21","2015-05-22","2017-11-02 4:18",2015
"1203",149,"Bombay Velvet","",0,"RACHEL SALTZ","Review: ‘Bombay Velvet’ Is a Bollywood Ode to American Gangster Movies","Anurag Kashyap&#8217;s movie about an evolving Bombay shows evidence of a changing Indian film scene.","2015-05-15","2015-05-15","2017-11-02 4:18",2015
"1204",150,"Mad Max: Fury Road","R",1,"A. O. SCOTT","Review: ‘Mad Max: Fury Road,’ Still Angry After All These Years","This George Miller film, with Tom Hardy as the hero, has the spirit of a sequel to the original: Speed and efficiency are of the essence, leavened with nasty biker wit and distaste for authority.","2015-05-14","2015-05-15","2017-11-02 4:18",2015
"1205",151,"Good Kill","R",1,"STEPHEN HOLDEN","Review: &#8216;Good Kill&#8217; Stars Ethan Hawke Fighting Enemies Half a World Away","This Andrew Niccol film is a blunt critique of remote-control warfare, which is transforming the reality of battle into a video game whose casualties are pixels on a screen.","2015-05-14","2015-05-15","2017-11-02 4:18",2015
"1206",152,"Where Hope Grows","PG-13",0,"NEIL GENZLINGER","Review: &#8216;Where Hope Grows,&#8217; a Baseball Career Lost and Relationships Found","Chris Dowling&#8217;s film begins with a clich&#233;d character, the failed athlete with a drinking problem, and features a young man with Down syndrome in his first acting role.","2015-05-14","2015-05-15","2017-11-02 4:18",2015
"1207",153,"Pitch Perfect 2","PG-13",0,"A. O. SCOTT","Review: &#8216;Pitch Perfect 2,&#8217; With Anna Kendrick and More Fat Amy","This sequel pits the Barden Bellas, the all-girl a cappella group, against some highly disciplined German singers, and gives Fat Amy a solo.","2015-05-14","2015-05-15","2017-11-02 4:18",2015
"1208",154,"Our Man In Tehran","",0,"NEIL GENZLINGER","Review: ‘Our Man in Tehran’ Recounts Iran Hostage Crisis Escape","The tale of how the Canadian ambassador and others helped six American Embassy workers escape Iran in 1980 makes a watchable documentary.","2015-05-14","2015-05-15","2017-11-02 4:18",2015
"1209",155,"In the Name of My Daughter","R",0,"NICOLAS RAPOLD","Review: &#8216;In the Name of My Daughter,&#8217; a Family-Business Scandal","This film dramatizes the Affaire Le Roux, a true-crime story about a mother who runs a casino, and the lawyer who manipulates her daughter to take control of it.","2015-05-14","2015-05-08","2017-11-02 4:18",2015
"1210",156,"El crítico","",0,"A. O. SCOTT","Review: In &#8216;The Film Critic,&#8217; a Snob Is Tripped Up by His Heartstrings","The Argentine director Hern&#225;n Guerschuny skewers the pretensions of movie criticism in this film, starring Rafael Spregelburd.","2015-05-14","2015-05-15","2017-11-02 4:18",2015
"1211",157,"Know How","",0,"DANIEL M. GOLD","Review: In &#8216;Know How,&#8217; Teenagers Portray Their Plight in Foster Care","The film presents stories drawn from the life experiences of its fledgling actors.","2015-05-14","2015-05-15","2017-11-02 4:18",2015
"1212",158,"I'll See You In My Dreams","PG-13",0,"STEPHEN HOLDEN","Review: In ‘I’ll See You in My Dreams,’ Blythe Danner Seeks Fulfillment","Ms. Danner plays a former singer who, with the help of colorful friends, strikes out in search of possible male companionship.","2015-05-14","2015-05-15","2017-11-02 4:18",2015
"1213",159,"Animals","",0,"A. O. SCOTT","Review: In &#8216;Animals,&#8217; a Couple in Love With Heroin","A college-educated, middle-class couple create a self-contained civilization in which heroin is a powerful force within their personal love story.","2015-05-14","2015-05-15","2017-11-02 4:18",2015
"1214",160,"One Cut, One Life","",1,"STEPHEN HOLDEN","Review: With &#8216;One Cut, One Life,&#8217; Ed Pincus and Lucia Small Document His Illness","In his final years, the documentary pioneer Ed Pincus joined with the filmmaker Lucia Small, to record his medical struggles and their own collaboration.","2015-05-13","2015-05-15","2017-11-02 4:18",2015
"1215",161,"The 100-Year-Old Man Who Climbed Out the Window and Disappeared","R",1,"NEIL GENZLINGER","Review: &#8216;The 100-Year-Old Man Who Climbed Out the Window and Disappeared&#8217;","This often droll Swedish movie is a new entry in the genre that might be called Old People Behaving Hilariously.","2015-05-07","2015-05-08","2017-11-02 4:18",2015
"1216",162,"The Seven Five","R",0,"MANOHLA DARGIS","Review: ‘The Seven Five,’ a Documentary About a Corrupt New York Cop","Tiller Russell’s documentary focuses on Michael Dowd, a Brooklyn police officer who in the late 1980s was earning $4,000 a week from illegal dealings with drug organizations.","2015-05-07","2015-05-08","2017-11-02 4:18",2015
"1217",163,"Preggoland","",0,"NEIL GENZLINGER","Review: &#8216;Preggoland.&#8217; It&#8217;s a Nice Place to Visit. Sort Of.","Jacob Tierney&#8217;s comedy focuses on a single, childless and irresponsible woman who pretends to be pregnant after a mistaken assumption.","2015-05-07","2015-05-08","2017-11-02 4:18",2015
"1218",164,"Playing It Cool","R",0,"JEANNETTE CATSOULIS","Review: ‘Playing It Cool,’ with Chris Evans","Cut loose from the flash-bang-wallop of the “Captain America” and “Avengers” franchises, Chris Evans seems lost.","2015-05-07","2015-05-08","2017-11-02 4:18",2015
"1219",165,"Noble","PG-13",0,"STEPHEN HOLDEN","Review: ‘Noble,’ the Crusade of a Children’s Rights Activist","The film follows Christina Noble, who emerged from a traumatic childhood in Dublin to build a foundation that helps thousands of children in Vietnam and Mongolia.","2015-05-07","2015-05-08","2017-11-02 4:18",2015
"1220",166,"The D Train","R",0,"MANOHLA DARGIS","Review: In &#8216;The D Train,&#8217; Jack Black and James Marsden in a Steamy Bromance","In this bromantic comedy, Mr. Black&#8217;s character wants Mr. Marsden&#8217;s to attend their high school reunion, but he gets a great deal more.","2015-05-07","2015-05-08","2017-11-02 4:18",2015
"1221",167,"Piku","",0,"RACHEL SALTZ","Review: In &#8216;Piku,&#8217; Amitabh Bachchan Plays a Dad to Deepika Padukone","A young career woman and her demanding, aging father bicker at home and on the road in this Hindi film directed by Shoojit Sircar.","2015-05-07","2015-05-08","2017-11-02 4:18",2015
"1222",168,"Hot Pursuit","PG-13",0,"A. O. SCOTT","Review: In &#8216;Hot Pursuit,&#8217; Sofia Vergara and Reese Witherspoon on the Run","The women, one the wife of a criminal and the other a police officer, are thrown together by improbable circumstances in this buddy comedy.","2015-05-07","2015-05-08","2017-11-02 4:18",2015
"1223",169,"Bravetown","R",0,"STEPHEN HOLDEN","Review: In &#8216;Bravetown,&#8217; a Bad Boy Redeems Himself Through D.J. Magic","The film is part high school dance competition movie and part shameless flag-waver.","2015-05-07","2015-05-08","2017-11-02 4:18",2015
"1224",170,"5 Flights Up","PG-13",0,"STEPHEN HOLDEN","Review: In &#8216;5 Flights Up,&#8217; a Marriage of Morgan Freeman and Diane Keaton","Mr. Freeman and Ms. Keaton play a Brooklyn couple who need to sell their fifth-floor walk-up. They find that in New York, real estate isn&#8217;t easy.","2015-05-07","2015-05-08","2017-11-02 4:18",2015
"1225",171,"Welcome to Me","R",1,"A. O. SCOTT","Review: Kristen Wiig as a Troubled Lottery Winner in ‘Welcome to Me’","Ms. Wiig&#8217;s character decides to spend a major financial windfall on buying her own talk show in this dark comedy directed by Shira Piven.","2015-04-30","2015-05-01","2017-11-02 4:18",2015
"1226",172,"Ride","R",0,"STEPHEN HOLDEN","Review: In &#8216;Ride,&#8217; Helen Hunt Goes Surfing","Directed and written by Ms. Hunt, this movie follows a high-strung New Yorker editor as she tracks down her son on the West Coast.","2015-04-30","2015-05-01","2017-11-02 4:18",2015
"1227",173,"Hyena","Not Rated",0,"STEPHEN HOLDEN","Review: In &#8216;Hyena,&#8217; a Rogue Cop Finds Himself in Too Deep","As kingpins do battle in London in Gerald Johnson&#8217;s drama, there&#8217;s plenty of human trafficking, drug smuggling and viscera.","2015-04-30","2015-05-01","2017-11-02 4:18",2015
"1228",174,"Far From the Madding Crowd","PG-13",0,"A. O. SCOTT","Review: &#8216;Far From the Madding Crowd,&#8217; the Rom-Com","Carey Mulligan stars in Thomas Vinterberg&#8217;s adaptation of the Thomas Hardy novel, with Matthias Schoenaerts, Tom Sturridge and Michael Sheen as her Victorian suitors.","2015-04-30","2015-05-22","2017-11-02 4:18",2015
"1229",175,"Cas & Dylan","",0,"STEPHEN HOLDEN","Review: &#8216;Cas &amp; Dylan,&#8217; a Road Movie Starring Richard Dreyfuss","The film follows a pair of mismatched travelers heading across Canada.","2015-04-30","2015-05-01","2017-11-02 4:18",2015
"1230",176,"Avengers: Age Of Ultron","PG-13",0,"MANOHLA DARGIS","Review: ‘Avengers: Age of Ultron’ Gets the Superband Back Together","The new installment in the “Avengers” franchise adds characters, including the Scarlet Witch and Quicksilver, even as its familiar heroes fight battles terrestrial and galactic.","2015-04-30","2015-05-01","2017-11-02 4:18",2015
"1231",177,"Days of Grace","",0,"A. O. SCOTT","&#8216;Days of Grace,&#8217; a Mexican Film by Everardo Gout","The film uses three plotlines that take place during successive World Cups, in 2002, 2006 and 2010.","2015-04-30","2015-05-01","2017-11-02 4:18",2015
"1232",178,"Creep","R",0,"ANDY WEBSTER","Review: &#8216;Creep,&#8217; a Horror Film With the Look of Found Footage","The actor and director Mark Duplass stars as a man seeking to leave a legacy for his unborn child.","2015-09-01","2015-06-23","2017-11-02 4:18",2015
"1233",179,"A Little Chaos","R",1,"STEPHEN HOLDEN","Review: In &#8216;A Little Chaos,&#8217; a Guileless Kate Winslet Offsets a Lavish Versailles","Ms. Winslet plays a gardener well ahead of her time in this Louis XIV-era costume drama directed by and starring Alan Rickman.","2015-06-25","2015-06-26","2017-11-02 4:18",2015
"1234",180,"Fresh Dressed","",1,"JON CARAMANICA","Review: &#8216;Fresh Dressed&#8217; Follows Hip-Hop From the Streets to the Runway","This documentary charts how hip-hop fashion initially absorbed what was around it, and then eventually became the inspiration for everyone else.","2015-06-25","2015-06-26","2017-11-02 4:18",2015
"1235",181,"Big Game","PG-13",1,"ANDY WEBSTER","Review: &#8216;Big Game&#8217; Stars Samuel L. Jackson as a President in Dire Straits","In this adventure, a Scandinavian teenager encounters the American president, who has bailed out of a doomed Air Force One over the Finnish woods.","2015-06-25","2015-06-26","2017-11-02 4:18",2015
"1236",182,"The Midnight Swim","",0,"ANDY WEBSTER","Review: &#8216;The Midnight Swim&#8217; Investigates a Mother&#8217;s Watery Death","Sarah Adina Smith&#8217;s chiller about three sisters at a lakeside home has one foot in its genre and one in a whole other place.","2015-06-25","2015-06-26","2017-11-02 4:18",2015
"1237",183,"The Little Death","Not Rated",0,"DANIEL M. GOLD","Review: &#8216;The Little Death&#8217; Plays With Narrative Form and Fetish","Josh Lawson&#8217;s polite sex comedy has the soul of a sitcom.","2015-06-25","2015-06-26","2017-11-02 4:18",2015
"1238",184,"Glass Chin","",0,"NICOLAS RAPOLD","Review: Noah Buschel’s ‘Glass Chin,’ an Updated Working-Class Noir","This story of a New York-area loan shark, restaurateur and boxing coach is full of hyperstylized shots, philosophizing speeches and no-way-out plotting.","2015-06-25","2015-06-26","2017-11-02 4:18",2015
"1239",185,"Ted 2","R",0,"MANOHLA DARGIS","Review: In &#8216;Ted 2,&#8217; the Foulmouthed Bear Tries to Prove He&#8217;s Human","In a quest to be a husband and father, the character voiced by Seth MacFarlane aligns his struggle with that of enslaved black Americans.","2015-06-25","2015-06-26","2017-11-02 4:18",2015
"1240",186,"Runoff","R",0,"STEPHEN HOLDEN","Review: In &#8216;Runoff,&#8217; a Rural Family Hits Desperate Times","Kimberly Levin&#8217;s directorial debut centers on the Freemans (Neal Huff and Joanne Kelly), struggling to raise a family and save their farm and business.","2015-06-25","2015-06-26","2017-11-02 4:18",2015
"1241",187,"Max","PG",0,"A. O. SCOTT","Review: In &#8216;Max,&#8217; a Shellshocked Dog Reverts to His Heroic Self","Boaz Yakin&#8217;s film, a blend of detective story and animal tale, depicts the healing of a slain marine&#8217;s military dog under the care of the man&#8217;s brother.","2015-06-25","2015-06-26","2017-11-02 4:18",2015
"1242",188,"Batkid Begins: The Wish Heard Around the World","PG",0,"JEANNETTE CATSOULIS","Review: In &#8216;Batkid Begins&#8217;, a Boy&#8217;s Simple Wish Whips Up Frenzied Adulation","Dana Nachman documents the overwhelming response to a 5-year-old cancer patient&#8217;s wish to become Batman.","2015-06-25","2015-06-26","2017-11-02 4:18",2015
"1243",189,"7 Minutes","",0,"STEPHEN HOLDEN","Review: In &#8216;7 Minutes,&#8217; From Jay Martin, a Bank Robbery Plan Implodes","Three friends decide to commit a crime, greatly underestimating the difficulty.","2015-06-25","2015-06-26","2017-11-02 4:18",2015
"1244",190,"Escobar: Paradise Lost","R",0,"JEANNETTE CATSOULIS","Review: &#8216;Escobar: Paradise Lost&#8217; Stars Benicio Del Toro as Drug Lord","In this fictional account of the Colombian kingpin, Pablo Escobar pulls an American surfer into his circle.","2015-06-25","2015-06-26","2017-11-02 4:18",2015
"1245",191,"What Happened, Miss Simone?","Not Rated",0,"MANOHLA DARGIS","Review: &#8216;What Happened, Miss Simone?&#8217; Documents Nina Simone&#8217;s Rise as Singer and Activist","This documentary, directed by Liz Garbus, chronicles the life of Nina Simone, the singer-musician whose social circle and civil rights activism grew along with her fame.","2015-06-23","2015-06-24","2017-11-02 4:18",2015
"1246",192,"Inside Out","PG",1,"A. O. SCOTT","Review: Pixar’s ‘Inside Out’ Finds the Joy in Sadness, and Vice Versa","Pete Docter’s new animated film, with the voices of television comedians like Amy Poehler, Mindy Kaling and Bill Hader, brings to life an 11-year-old’s interior drama.","2015-06-18","2015-06-19","2017-11-02 4:18",2015
"1247",193,"Phantom Halo","R",1,"HELEN T. VERONGOS","Review: &#8216;Phantom Halo,&#8217; a Crime Caper With Thomas Brodie-Sangster","Rebecca Romijn and Luke Kleintank are also in the cast of this drama, which focuses on the sons of a dissolute father.","2015-06-18","2015-06-19","2017-11-02 4:18",2015
"1248",194,"Eden","R",1,"JEANNETTE CATSOULIS","Review: &#8216;Eden,&#8217; a D.J.&#8217;s Passion for Electronic Music, by Mia Hansen-Love","The film chronicles the electronic music scene in 1990s Paris, from boom to burnout.","2015-06-18","2015-06-19","2017-11-02 4:18",2015
"1249",195,"Balls Out","R",1,"ANDY WEBSTER","Review: &#8216;Balls Out,&#8217; a Sports-Movie Satire Packed With &#8216;S.N.L.&#8217; Talent","&#8220;This isn&#8217;t about winning,&#8221; says the coach of the motley intramural football team at the center of this comedy. &#8220;It&#8217;s about winning at the last possible second.&#8221;","2015-06-18","2015-06-19","2017-11-02 4:18",2015
"1250",196,"The Face of an Angel","",0,"JEANNETTE CATSOULIS","Review: &#8216;The Face of an Angel&#8217; Dabbles in Murder and Culpability","The death of Meredith Kercher, a British student, in Italy preoccupied the news media and the public. This film by Michael Winterbottom is a fictional take on the event.","2015-06-18","2015-06-19","2017-11-02 4:18",2015
"1251",197,"The Overnight","R",0,"MANOHLA DARGIS","Review: In ‘The Overnight,’ Newcomers Try Hard to Make Friends","Bland meets bold in “The Overnight,” a comedy that coyly dips its toe and a few other body parts in the new sexual revolution.","2015-06-18","2015-06-19","2017-11-02 4:18",2015
"1252",198,"Infinitely Polar Bear","R",0,"MANOHLA DARGIS","Review: &#8216;Infinitely Polar Bear&#8217; Traces a Dad&#8217;s Ups and Downs","This debut feature from the writer-director Maya Forbes concerns a family whose father (Mark Ruffalo) has manic depression, as seen by his young daughter.","2015-06-18","2015-06-19","2017-11-02 4:18",2015
"1253",199,"Hippocrates: Diary of a French Doctor","",0,"MANOHLA DARGIS","Review: ‘Hippocrates’ Offers Life, Death and Teachable Moments","This film, subtitled &#8220;Diary of a French Doctor,&#8221; unfolds pretty much like an average episode of &#8220;ER,&#8221; though with more French flag waving and less storeroom romancing.","2015-06-18","2015-06-19","2017-11-02 4:18",2015
"1254",200,"Gabriel","",0,"DANIEL M. GOLD","Review: &#8216;Gabriel&#8217; Stars Rory Culkin as a Young Man With Mental Illness","An obsessive and troubled Gabriel leaves a psychiatric hospital and strains the lives of his loving mother and childhood girlfriend in this tense film.","2015-06-18","2015-06-19","2017-11-02 4:18",2015
"1255",201,"Burying the Ex","R",0,"BEN KENIGSBERG","Review: &#8216;Burying the Ex,&#8217; a Joe Dante Zombie Tale","A looming breakup doesn&#8217;t go as planned in the first feature in six years from the director of the &#8220;Gremlins&#8221; movies and &#8220;The &#8217;Burbs.&#8221;","2015-06-18","2015-06-19","2017-11-02 4:18",2015
"1256",202,"ABCD 2 (Anybody Can Dance 2)","",0,"ANDY WEBSTER","Review: &#8216;ABCD 2,&#8217; TV Dance Stars Try to Rebuild Their Team and Reputation","The leader of the Mumbai Stunners troupe hopes to turn around the group&#8217;s fortunes in this Remo D&#8217;Souza Bollywood sequel.","2015-06-18","2015-06-19","2017-11-02 4:18",2015
"1257",203,"Dope","R",0,"A. O. SCOTT","Review: ‘Dope,’ a Teenage Comedy, Plays With Stereotypes","In Rick Famuyiwa&#8217;s film, Malcolm, a smart student and musician prepping for a Harvard interview, does a favor for a drug dealer and winds up with a gun and a backpack of contraband.","2015-06-18","2015-06-19","2017-11-02 4:18",2015
"1258",204,"Hamari Adhuri Kahani","",0,"ANDY WEBSTER","Review: ‘Hamari Adhuri Kahani’ Tours a Bad Marriage and the Jungle","Mohit Suri&#8217;s melodramatic film finds time amid its globe-trotting adventure to comment on domestic abuse in India.","2015-06-12","2015-06-12","2017-11-02 4:18",2015
