"","X","display_title","mpaa_rating","critics_pick","byline","headline","summary_short","publication_date","opening_date","date_updated","openingyear"
"1",1,"The Last Family","",1,"GLENN KENNY","Review: In ‘The Last Family,’ a Polish Artist’s Tragic Home Life","The difficult family life of the Polish painter Zdzislaw Beksinski makes for an often funny but also harrowing and heartbreaking film.","2018-01-25","2017-01-26","2018-02-02 17:44:01",2017
"2",2,"Legion of Brothers","",0,"KEN JAWOROWSKI","Review: ‘Legion of Brothers’ on Secret Missions in Afghanistan","This documentary tells the stories of Green Berets who were sent to topple the Taliban immediately after the Sept. 11 terrorist attacks.","2017-05-17","2017-01-01","2017-11-02 04:18:26",2017
"3",3,"Speed Sisters","",0,"JEANNETTE CATSOULIS","Review: ‘Speed Sisters,’ Revving to Go in the West Bank","This documentary centers on the challenges faced by five young women who make up the first female streetcar racing team in the Middle East.","2017-02-09","2017-01-27","2017-11-02 04:18:26",2017
"4",4,"The Salesman","PG-13",1,"A.O. SCOTT","Review: In ‘The Salesman,’ Scenes From a Marriage in Tehran","The ghost of Willy Loman hovers over this film from Asghar Farhadi, but it seems occupied with its own dramatic issues, our critic writes.","2017-01-26","2017-01-27","2017-11-02 04:18:26",2017
"5",5,"Raees","",1,"RACHEL SALTZ","Review: Shah Rukh Khan as ‘Raees,’ a Villain but Still a Do-Gooder","The “king of Bollywood” rarely plays the bad guy, but in this film he’s a criminal who’s also fighting corruption in 1980s and ’90s India.","2017-01-26","2017-01-25","2017-11-02 04:18:26",2017
"6",6,"The Daughter","",0,"JEANNETTE CATSOULIS","Review: A Long-Buried Family Secret Explodes in ‘The Daughter’","This drama, set in a declining Australian logging town, centers on an estranged son who comes home, smoldering with resentment.","2017-01-26","2017-01-27","2017-11-02 04:18:26",2017
"7",7,"Resident Evil: The Final Chapter","R",0,"GLENN KENNY","Review: Alice Returns in ‘Resident Evil: The Final Chapter’","In the sixth entry in Paul W. S. Anderson’s dystopian franchise, Milla Jovovich’s character is back in zombie land, aided by her former nemesis the Red Queen.","2017-01-26","2017-01-27","2017-11-02 04:18:26",2017
"8",8,"The Age of Consequences","",0,"GLENN KENNY","Review: Climate Change and Conflicts in ‘The Age of Consequences’","Jared P. Scott’s film explores the issue from the perspective of military experts rather than that of scientists. The information is compelling, but the movie is ham-handed.","2017-01-26","2017-01-27","2017-11-02 04:18:26",2017
"9",9,"Kung Fu Yoga","",0,"ANDY WEBSTER","Review: ‘Kung Fu Yoga’ Features Jackie Chan Saving the Day","Mr. Chan mugs and thwarts assailants in this harmless international romp.","2017-01-26","2017-01-27","2017-11-02 04:18:26",2017
"10",10,"Lost in Florence","",0,"NEIL GENZLINGER","Review: ‘Lost in Florence’ Blends Romantic Fantasy and a Rough Sport","Evan Oppenheimer’s film is a mild romantic drama with a guy perspective, featuring beautiful women and a brutal athletic spectacle.","2017-01-26","2017-01-27","2017-11-02 04:18:26",2017
"11",11,"Midsummer in Newtown","",0,"BEN KENIGSBERG","Review: ‘Midsummer in Newtown’ Revisits the Pain of Sandy Hook","This documentary explores the value of a Shakespeare production intended to help residents heal after the horrific school shooting.","2017-01-26","2017-01-27","2017-11-02 04:18:26",2017
"12",12,"Gold","R",0,"A.O. SCOTT","Review: Matthew McConaughey Mines Profane Capitalism in ‘Gold’","He plays a rogue who strikes it rich, a thrill complicated by the corruptions of wealth, treachery and the schemer’s own fecklessness.","2017-01-26","2017-01-27","2017-11-02 04:18:26",2017
"13",13,"A Dog’s Purpose","PG",0,"NEIL GENZLINGER","Review: ‘A Dog’s Purpose,’ With Many Lives and Many Clichés","This film, opening amid a call for a PETA boycott, is a string of hero-dog fantasies and observations from the canine point of view.","2017-01-25","2017-01-27","2017-11-02 04:18:26",2017
"14",14,"Saving Banksy","Not Rated",1,"ANDY WEBSTER","Review: ‘Saving Banksy’ Affirms Graffiti’s Populist Values","This documentary honors the street-based work of the British artist known as Banksy, and implicitly criticizes those who would try to turn profits from it.","2017-01-19","2017-01-13","2017-11-02 04:18:26",2017
"15",15,"Split","PG-13",0,"A.O. SCOTT","Review: M. Night Shyamalan’s ‘Split’ Has Personality. O.K., Personalities. Lots.","“Split” represents something of a return to form — or formula — for its writer and director, M. Night Shyamalan. It’s all plot, spun into a ribbon of suspense.","2017-01-19","2017-01-20","2017-11-02 04:18:26",2017
"16",16,"The Red Turtle","PG",0,"A.O. SCOTT","Review: ‘The Red Turtle,’ Life Marooned With an Ornery Reptile","This largely nonverbal animated French-Belgian-Japanese coproduction, from Studio Ghibli, the home of Hayao Miyazaki, flirts with eco-mysticism.","2017-01-19","2017-01-20","2017-11-02 04:18:26",2017
"17",17,"Staying Vertical","Not Rated",0,"A.O. SCOTT","Review: The French Countryside Holds Surprises in ‘Staying Vertical’","In Alain Guiraudie’s quirky hybrid of thriller, sex comedy and folk tale, a screenwriter meets a shepherdess and, voilà, a baby is born.","2017-01-19","2017-01-20","2017-11-02 04:18:26",2017
"18",18,"The Sunshine Makers","",0,"MANOHLA DARGIS","Review: Turning the World On, the LSD Way, in ‘The Sunshine Makers’","Cosmo Feilding Mellen’s documentary suggests that two young men saw themselves as spreading transcendence one hit at a time.","2017-01-19","2017-01-13","2017-11-02 04:18:26",2017
"19",19,"XXX: Return of Xander Cage","PG-13",0,"JEANNETTE CATSOULIS","Review: ‘XXX: Return of Xander Cage’ Deploys Vin Diesel on a New Mission","In the third installment of this franchise, the hero and new oddball allies set out to retrieve a stolen superweapon.","2017-01-19","2017-01-20","2017-11-02 04:18:26",2017
"20",20,"We Are the Flesh","Not Rated",0,"GLENN KENNY","Review: Cannibalism, Torture and Apocalypse in ‘We Are the Flesh’","This debut feature by the Mexican writer and director Emiliano Rocha Minter seems to build on the character of Coffin Joe in the 1960s films by José Mojica Marins.","2017-01-19","2017-01-20","2017-11-02 04:18:26",2017
"21",21,"The Founder","PG-13",0,"MANOHLA DARGIS","Review: ‘The Founder,’ the Story of a Supersize Businessman","Mr. Keaton’s kinetic performance as the man who made McDonald’s what it is today doesn’t enhance the movie; it is the movie.","2017-01-19","2017-01-20","2017-11-02 04:18:26",2017
"22",22,"Sleepless","R",0,"A.O. SCOTT","Review: ‘Sleepless,’ but No Need to Reach for the Sominex","This entry in the dad-to-the-rescue action-movie genre doesn’t have enough twists to even tie a shoelace.","2017-01-13","2017-01-13","2017-11-02 04:18:26",2017
"23",23,"Monster Trucks","PG",1,"ANDY WEBSTER","Review: Horses Under the Hood? In ‘Monster Trucks,’ Try a Cephalopod","A small-town teenager and a creature released by a geyser are unlikely friends in this live-action eco-fable from the “Ice Age” director Chris Wedge.","2017-01-12","2017-01-13","2017-11-02 04:18:26",2017
"24",24,"Reset","",1,"GIA KOURLAS","Review: ‘Reset’ Follows Benjamin Millepied’s Efforts to Rejuvenate Paris Opera Ballet","The job didn’t work out in the end, but this riveting film documents a choreographer’s cheerfully tenacious effort as well as his work on one ballet.","2017-01-12","2017-01-13","2017-11-02 04:18:26",2017
"25",25,"The Son of Joseph","",1,"BEN KENIGSBERG","Review: ‘The Son of Joseph’ Fancifully Repackages the Nativity","Eugène Green’s new movie is divided into five sections, each titled after a biblical episode.","2017-01-12","2017-01-13","2017-11-02 04:18:26",2017
"26",26,"Claire in Motion","",0,"MANOHLA DARGIS","Review: A Husband Vanishes in ‘Claire in Motion.’ Mysteries Multiply.","In this film, the latest written and directed by Lisa Robinson and Annie J. Howell, a wife searches for clues and finds larger unanswered questions.","2017-01-12","2017-01-13","2017-11-02 04:18:26",2017
"27",27,"Bad Kids of Crestview Academy","R",0,"ANDY WEBSTER","Review: ‘Bad Kids of Crestview Academy’ Brings Blood to Detention","Prep-school students in Saturday detention are trapped on campus to die one by one in this film directed by Ben Browder, a sequel to “Bad Kids Go to Hell.”","2017-01-12","2017-01-13","2017-11-02 04:18:26",2017
"28",28,"The Bye Bye Man","PG-13",0,"GLENN KENNY","Review: ‘The Bye Bye Man,’ Oddly Overstaying His Welcome","This movie melds the summon-the-evil-by-its-name convention with the old try-not-to-think-of-an-elephant mind game, with scary results.","2017-01-12","2017-01-13","2017-11-02 04:18:26",2017
"29",29,"100 Streets","",0,"NEIL GENZLINGER","Review: ‘100 Streets,’ Where an Ex-Jock, a Cabby and a Thug Struggle","Idris Elba is among the stars of this Jim O’Hanlon film, a converging-narratives movie set in London.","2017-01-12","2017-01-13","2017-11-02 04:18:26",2017
"30",30,"One Piece Film: Gold","",0,"ANDY WEBSTER","Review: ‘One Piece Film: Gold,’ a Frantic Hunt for Pirate Loot","This entry in the “One Piece” anime franchise involves the liberation of gamblers on a floating casino complex.","2017-01-09","2017-01-10","2017-11-02 04:18:26",2017
"31",31,"Underworld: Blood Wars","R",0,"BEN KENIGSBERG","Review: ‘Underworld: Blood Wars,’ Bathed in Blue and Partied Out","This action-horror franchise about warring vampires and werewolves returns for a fifth outing. But is it a sequel or a dissertation?","2017-01-06","2017-01-06","2017-11-02 04:18:26",2017
"32",32,"The Ardennes","Not Rated",0,"A.O. SCOTT","Review: In ‘The Ardennes,’ a Freed Convict Returns Home to a New Reality","Robin Pront’s film depicts a man who took the fall for a crime and who catches up with his brother and his girlfriend, now reformed and in a relationship, four years later.","2017-01-05","2017-01-06","2017-11-02 04:18:26",2017
"33",33,"Arsenal","R",0,"JEANNETTE CATSOULIS","Review: ‘Arsenal’ Finds Nicolas Cage as a Criminal, Not Playing Nice","This movie, directed by Steven C. Miller, follows two brothers under pressure by a crime boss in Mississippi.","2017-01-05","2017-01-06","2017-11-02 04:18:26",2017
"34",34,"Master","",0,"BEN KENIGSBERG","Review: It’s Slick, but ‘Master’ Is No James Bond Movie","The bloat of this routine South Korean crime thriller, directed by Cho Ui-seok, magnifies its generic qualities.","2017-01-05","2017-01-06","2017-11-02 04:18:26",2017
"35",35,"Railroad Tigers","",0,"GLENN KENNY","Review: ‘Railroad Tigers’ Features a Resourceful Jackie Chan","Mr. Chan, 62, dazzles in this action movie set during the Second Sino-Japanese War, but the most challenging moves are left to younger stuntmen.","2017-01-05","2017-01-06","2017-11-02 04:18:26",2017
"36",36,"20th Century Women","R",1,"MANOHLA DARGIS","Review: 1 Teenage Boy and 3 Mothers in ‘20th Century Women’","Annette Bening stars as a complicated and divorced Santa Barbara mother in Mike Mills’s funny, emotionally piercing new film.","2016-12-27","2017-01-20","2017-11-02 04:18:26",2017
"37",37,"Live by Night","R",0,"MANOHLA DARGIS","Review: He Pledges Allegiance Only to His Tommy Gun, in ‘Live by Night’","Ben Affleck directed and stars in this gangster movie set in the 1920s, in which he tries to pour new wine into a bullet-riddled vessel.","2016-12-22","2017-01-13","2017-11-02 04:18:26",2017
"38",38,"Silence","R",0,"MANOHLA DARGIS","Review: Questions and Prayers Go Unanswered in Scorsese’s ‘Silence’","In Martin Scorsese’s film, Jesuit priests in 17th-century Japan operate underground to keep their religion alive when they and their adherents are persecuted.","2016-12-22","2017-01-06","2017-11-02 04:18:26",2017
"39",39,"Hidden Figures","PG",0,"A. O. SCOTT","Review: ‘Hidden Figures’ Honors 3 Black Women Who Helped NASA Soar","The women, part of the giant step for mankind, have their stories told in this movie directed by Theodore Melfi.","2016-12-22","2017-01-06","2017-11-02 04:18:26",2017
"40",40,"A Monster Calls","PG-13",0,"NEIL GENZLINGER","Review: ‘A Monster Calls,’ Offering a Boy a Lifeline","Liam Neeson is the voice of a giant tree that helps a child with a vivid imagination through difficult times.","2016-12-22","2017-01-06","2017-11-02 04:18:26",2017
"41",41,"Patriots Day","R",0,"GLENN KENNY","Review: ‘Patriots Day,’ a Mosaic of Portraits From Marathon Bombing","This film declines to consider the jihadist ideology that apparently motivated the Boston Marathon bombers.","2016-12-20","2017-01-13","2017-11-02 04:18:26",2017
"42",42,"Breaking Point: The War for Democracy in Ukraine","",0,"KEN JAWOROWSKI","Review: ‘Breaking Point’ Finds Fake News and Real Violence in Ukraine","The documentary, directed by Mark Jonathan Harris and Oles Sanin, looks at Russian aggression toward the country, which is struggling to rebuild.","2018-03-01","2017-02-14","2018-03-01 12:04:05",2017
"43",43,"Liza, Liza, Skies Are Grey","",0,"BEN KENIGSBERG","Review: ‘Liza, Liza, Skies Are Grey’ Seems Out of Step With Its Period","Teenagers on the run, with a motorcycle, and hints of the 1960s.","2017-08-16","2017-02-02","2017-11-02 04:18:26",2017
"44",44,"Get Out","R",1,"MANOHLA DARGIS","Review: In ‘Get Out,’ Guess Who’s Coming to Dinner? (Bad Idea!)","This movie by Jordan Peele, his first as a director of feature films, is a skillful hybrid, blending genres into something terrifying.","2017-02-23","2017-02-24","2017-11-02 04:18:26",2017
"45",45,"Dying Laughing","",0,"STEPHEN HOLDEN","Review: ‘Dying Laughing,’ About Bombing Onstage, or, Conversely, Killing","Paul Toogood and Lloyd Stanton’s documentary talks to comedians about the rigors of the road and other stresses of their profession.","2017-02-23","2017-02-24","2017-11-02 04:18:26",2017
"46",46,"As You Are","",0,"GLENN KENNY","Review: In ‘As You Are,’ a Nod to Nirvana, and a Loaded Gun","Two teenage boys in the 1990s bond over alt-rock only to have their friendship strained in this first feature directed by Miles Joris-Peyrafitte.","2017-02-23","2017-02-24","2017-11-02 04:18:26",2017
"47",47,"Bitter Harvest","R",0,"JEANNETTE CATSOULIS","Review: ‘Bitter Harvest’ Offers a Clunky Lesson in Ukrainian History","Prettily filmed yet parochial, this film follows two lovers through a mass starvation in the early 1930s.","2017-02-23","2017-02-24","2017-11-02 04:18:26",2017
"48",48,"Paraguay Remembered","",0,"GLENN KENNY","Review: In ‘Paraguay Remembered,’ Does Time Heal All Wounds?","This documentary reflects on a legacy of political turmoil as the director, Dominique Dubosc, returns to Paraguay after 40 years.","2017-02-23","2017-02-24","2017-11-02 04:18:26",2017
"49",49,"My Life as a Zucchini","PG-13",0,"A.O. SCOTT","Review: ‘My Life as a Zucchini,’ an Oscar Nominee With Depth and Soul","This animated tale of an orphan, freighted with the name Icare, or Icarus, is more charming than grim.","2017-02-23","2017-02-24","2017-11-02 04:18:26",2017
"50",50,"Rock Dog","PG",0,"NEIL GENZLINGER","Review: Guard the Sheep? He’d Rather Be a ‘Rock Dog’","An animated movie for children is elevated by a fine vocal performance from Eddie Izzard.","2017-02-23","2017-02-24","2017-11-02 04:18:26",2017
"51",51,"From Nowhere","",1,"STEPHEN HOLDEN","Review: Immigrants ‘From Nowhere,’ Anxiously Living Under the Radar","Julianne Nicholson plays a Bronx high school teacher who tries to help three undocumented students cope with the threat of being discovered by the authorities.","2017-02-16","2017-02-17","2017-11-02 04:18:26",2017
"52",52,"Lovesong","",1,"STEPHEN HOLDEN","Review: Two Friends Dance a Wary Tango in ‘Lovesong’","The movie, directed by So Yong Kim, explores the mystery of unspoken love.","2017-02-16","2017-02-17","2017-11-02 04:18:26",2017
"53",53,"Fist Fight","R",0,"A.O. SCOTT","Review: Ice Cube and Charlie Day Face Off in ‘Fist Fight’","It’s the last day of school, and two teachers are getting ready to rumble in this comedy directed by Richie Keen.","2017-02-16","2017-02-17","2017-11-02 04:18:26",2017
"54",54,"American Fable","",0,"MANOHLA DARGIS","Review: ‘American Fable,’ Pastoral With a Wolf Howling","Anne Hamilton’s film seems full of suspenseful promise as it opens on an isolated swath of the country’s heartland, but the story finds no traction.","2017-02-16","2017-02-17","2017-11-02 04:18:26",2017
"55",55,"How Heavy This Hammer","",0,"GLENN KENNY","Review: In ‘How Heavy This Hammer,’ Life Takes a Toll on Dad","Written and directed by Kazik Radwanski, this film was shot in practically all hand-held almost close-ups.","2017-02-16","2017-02-17","2017-11-02 04:18:26",2017
"56",56,"Keep Quiet","",0,"GLENN KENNY","Review: An Anti-Semite Learns of His Jewish Roots in ‘Keep Quiet’","This documents how the career of the far-right Hungarian politician Csanad Szegedi was upended when he found out about his lineage.","2017-02-16","2017-02-10","2017-11-02 04:18:26",2017
"57",57,"My Name Is Emily","",0,"JEANNETTE CATSOULIS","Review: Saving Dad, and Finding Herself, in ‘My Name Is Emily’","Evanna Lynch, of “Harry Potter,” plays a teenager who leaves her foster home to search for her institutionalized father.","2017-02-16","2017-02-17","2017-11-02 04:18:26",2017
"58",58,"Everybody Loves Somebody","PG-13",0,"JEANNETTE CATSOULIS","Review: ‘Everybody Loves Somebody,’ a Rom-Com With Bite","A messed-up heroine is asked to choose between naughty and nice in Catalina Aguilar Mastretta’s sophomore feature, which is predictable but satisfying.","2017-02-16","2017-02-17","2017-11-02 04:18:26",2017
"59",59,"The Great Wall","PG-13",0,"MANOHLA DARGIS","Review: Matt Damon Battles Clusters of Monsters in ‘The Great Wall’","Zhang Yimou’s costume spectacle offers drooling creatures, glowering warriors, a swaggering mercenary and a message about China’s might.","2017-02-16","2017-02-17","2017-11-02 04:18:26",2017
"60",60,"A Cure for Wellness","R",0,"A.O. SCOTT","Review: ‘A Cure for Wellness’ Is a Riot of Film References. With Eels.","This thriller from Gore Verbinski makes for a nice game of Name That Movie Influence as it treads the boundary between homage and outright plagiarism.","2017-02-16","2017-02-17","2017-11-02 04:18:26",2017
"61",61,"Kedi","Not Rated",1,"GLENN KENNY","Review: Cute Cats of ‘Kedi,’ Rekindling a ‘Love of Life’","This documentary profiles distinctive street cats in Istanbul and the human communities that interact with them.","2017-02-09","2017-02-10","2017-11-02 04:18:26",2017
"62",62,"A United Kingdom","PG-13",1,"GLENN KENNY","Review: ‘A United Kingdom’ With Love That Tested Racial Tolerance","This romance illustrates the struggle for African independence from colonialism, under the shadow of apartheid.","2017-02-09","2017-02-10","2017-11-02 04:18:26",2017
"63",63,"I Am Jane Doe","",0,"JEANNETTE CATSOULIS","Review: ‘I Am Jane Doe’ Takes Aim at Escort Ads","This documentary is a chronicle of the fight to hold an online classifieds site liable for children being sold into sex slavery.","2017-02-09","2017-02-10","2017-11-02 04:18:26",2017
"64",64,"Don’t Hang Up","R",0,"NEIL GENZLINGER","Review: ‘Don’t Hang Up’ Has a Menace on the Line","This formulaic horror movie features teenagers behaving badly and suffering the consequences.","2017-02-09","2017-02-10","2017-11-02 04:18:26",2017
"65",65,"Eagles of Death Metal","",0,"NEIL GENZLINGER","Review: ‘Eagles of Death Metal’ Revisits the Paris Terror Attack","Colin Hanks’s documentary follows the band that was playing at the Bataclan in Paris when terrorists struck in 2015.","2017-02-09","2017-02-10","2017-11-02 04:18:26",2017
"66",66,"Fifty Shades Darker","R",0,"MANOHLA DARGIS","Review: ‘Fifty Shades Darker,’ and Only Half as Watchable","Will moviegoers want to surrender control to this sequel to “Fifty Shades of Grey”?","2017-02-09","2017-02-10","2017-11-02 04:18:26",2017
"67",67,"The Island Funeral","",0,"GLENN KENNY","Review: ‘The Island Funeral’ Goes on a Restless Road Trip","This second feature by the Thai director Pimpaka Towira finds three young adults on an enigmatic journey.","2017-02-09","2017-02-09","2017-11-02 04:18:26",2017
"68",68,"John Wick: Chapter 2","R",0,"JEANNETTE CATSOULIS","Review: ‘John Wick: Chapter 2,’ a Roman Holiday With Shots Not Sparks","This sequel is an altogether more solemn affair than the original, weighed down by the philosophy that more is always more.","2017-02-09","2017-02-10","2017-11-02 04:18:26",2017
"69",69,"Left on Purpose","",0,"BEN KENIGSBERG","Review: ‘Left on Purpose’ Follows a Man Who Plans to Kill Himself","This documentary focuses on Mayer Vishner, a man who has decided to end his life, and finds the filmmaker in an uncomfortable position.","2017-02-09","2017-02-10","2017-11-02 04:18:26",2017
"70",70,"1 Night","",0,"NEIL GENZLINGER","Review: In ‘1 Night,’ a Hotel, 2 Couples, a Bad Prom and a Reckoning","This debut feature by Minhal Baig has two high school students, a couple in their 30s and a dash of charm.","2017-02-09","2017-02-10","2017-11-02 04:18:26",2017
"71",71,"The Lego Batman Movie","PG",0,"MANOHLA DARGIS","Review: In ‘The Lego Batman Movie,’ Toys and Heroes, What’s Not to Like?","Warner Bros. offers amusement at its own expense and Will Arnett gives great voice to Gotham’s brooder, but this new movie is still a commercial.","2017-02-08","2017-02-10","2017-11-02 04:18:26",2017
"72",72,"Rings","PG-13",0,"NEIL GENZLINGER","Review: In ‘Rings,’ Best Not Go to the Videotape","The latest in a horror franchise that began in Japan, this film fills in the back story of Samara, the girl who kills via VCR.","2017-02-03","2017-02-03","2017-11-02 04:18:26",2017
"73",73,"I Am Not Your Negro","PG-13",1,"A.O. SCOTT","Review: ‘I Am Not Your Negro’ Will Make You Rethink Race","Raoul Peck’s documentary is an important introduction to James Baldwin’s work and an advanced seminar in racial politics.","2017-02-02","2017-02-03","2017-11-02 04:18:26",2017
"74",74,"This Is Everything: Gigi Gorgeous","",0,"GLENN KENNY","Review: ‘This Is Everything: Gigi Gorgeous,’ a Self-Made Cover Girl","Barbara Kopple’s film documents how Gigi Gorgeous, formerly Gregory Allan Lazzarato, took control of her transgender destiny with the support of her family.","2017-02-02","2017-02-03","2017-11-02 04:18:26",2017
"75",75,"Eloise","R",0,"JEANNETTE CATSOULIS","Review: ‘Eloise’ Has the Usual Haunted-Hospital Clichés","Robert Legato’s horror movie is “a strange mix of the recycled and the surreal,” Jeannette Catsoulis writes.","2017-02-02","2017-02-03","2017-11-02 04:18:26",2017
"76",76,"A Good American","",0,"BEN KENIGSBERG","Review: In ‘A Good American,’ Examining Sept. 11 and Data Collection","Friedrich Moser’s documentary employs re-enactments, moving graphics and a Philip Glass-like score.","2017-02-02","2017-02-03","2017-11-02 04:18:26",2017
"77",77,"Growing Up Smith","PG-13",0,"NEIL GENZLINGER","Review: ‘Growing Up Smith’ Plants a Boy From India in 1979 America","This gentle coming-of-age film centers on a youngster caught between two cultures and struggling to adapt in suburbia.","2017-02-02","2017-02-03","2017-11-02 04:18:26",2017
"78",78,"The Space Between Us","PG-13",0,"BEN KENIGSBERG","Review: ‘The Space Between Us,’ the Story of a Boy Who Fell to Earth","Peter Chelsom’s movie concerns a young human (Asa Butterfield), raised in isolation on Mars, who visits Earth and a video-chat pal (Britt Robertson).","2017-02-02","2017-02-03","2017-11-02 04:18:26",2017
"79",79,"The Comedian","R",0,"MANOHLA DARGIS","Review: Robert De Niro as ‘The Comedian,’ a Has-Been Seeking a Comeback","Joined by a cast that includes Edie Falco and Harvey Keitel, Mr. De Niro plays an insult comic in a film that, like its jokes, lacks zing.","2017-02-02","2017-02-03","2017-11-02 04:18:26",2017
"80",80,"Mr. Gaga","",0,"GLENN KENNY","Review: ‘Mr. Gaga’ Doesn’t Sing but Has His Own (Dance) Language","Tomer Heymann’s documentary on the Israeli choreographer Ohad Naharin is a scattered and somewhat confused film about an intriguing and complicated man.","2017-01-31","2017-02-01","2017-11-02 04:18:26",2017
"81",81,"After Auschwitz","",0,"KEN JAWOROWSKI","Review: ‘After Auschwitz’ Looks at Six Survivors and Their Lives","The documentary traces the experiences of six women who settled in the United States after the end of World War II.","2018-04-19","2017-03-25","2018-05-18 02:44:02",2017
"82",82,"Five Came Back","",1,"BEN KENIGSBERG","Review: ‘Five Came Back,’ and Inspired the Likes of Spielberg","A screen adaptation of Mark Harris’s 2014 book adds visuals to the story of five Hollywood directors who served in World War II with cameras in tow.","2017-03-30","2017-03-31","2017-11-02 04:18:27",2017
"83",83,"Ghost in the Shell","PG-13",0,"MANOHLA DARGIS","Review: In ‘Ghost in the Shell,’ a Cyborg With Soul","Scarlett Johansson, playing a cyborg called Major, rises above it all in the thrill-free science fiction thriller.","2017-03-30","2017-03-31","2017-11-02 04:18:27",2017
"84",84,"All This Panic","",0,"JEANNETTE CATSOULIS","Review: ‘All This Panic,’ a Cinematic Confidant of Teenage Girls","This limber, light-footed documentary becomes a sort of dreamy film diary for the girls it profiles.","2017-03-30","2017-03-31","2017-11-02 04:18:27",2017
"85",85,"The Boss Baby","PG",0,"NEIL GENZLINGER","Review: ‘The Boss Baby’ Puts Alec Baldwin in Diapers, Sort Of","An animated feature starring a newborn with an oh-so-familiar voice may confuse the kiddies, but grown-ups should get a kick out of it.","2017-03-30","2017-03-31","2017-11-02 04:18:27",2017
