"","X","display_title","mpaa_rating","critics_pick","byline","headline","summary_short","publication_date","opening_date","date_updated","openingyear"
"1678",111,"Transcendence","PG-13",0,"MANOHLA DARGIS","I Am My Own Monster (Technology Rules!)","“Transcendence” stars Johnny Depp as an artificial-intelligence genius whose wife uploads his consciousness into a supermachine after anti-technology extremists shoot him.","2014-04-17","2014-04-18","2017-11-02 4:18",2014
"1679",112,"Bears","G",0,"NICOLAS RAPOLD","A Bear, Her Cubs and the Wilderness","Disney’s “Bears” is the chronicle of a year in the hungry life of one bear and her two cubs in the Alaskan wilderness.","2014-04-17","2014-04-18","2017-11-02 4:18",2014
"1680",113,"Heaven is for Real","PG",0,"JEANNETTE CATSOULIS","His Résumé Before the Age of 4: ‘I Saw Jesus on a Horse’","The 2010 best-selling book “Heaven Is for Real” has made it to the screen, starring Greg Kinnear.","2014-04-15","2014-04-16","2017-11-02 4:18",2014
"1681",114,"Rio 2","G",0,"JEANNETTE CATSOULIS","Domesticated Macaws Reclaiming Their Wild Side","In “Rio 2,” a mated pair of blue macaws and their brood leave Rio for the lush perils of the Amazon rain forest.","2014-04-10","2014-04-11","2017-11-02 4:18",2014
"1682",115,"Draft Day","R",0,"A. O. SCOTT","Writing a Playbook That Ensures Glory","Kevin Costner plays the beleaguered general manager of the Cleveland Browns in “Draft Day.”","2014-04-10","2014-04-11","2017-11-02 4:18",2014
"1683",116,"Oculus","R",0,"BEN KENIGSBERG","On the Wall, Who’s the Deadliest One of All?","Karen Gillan and Brenton Thwaites play siblings seeking clues to their parents’ fate in a tale alternating between time periods.","2014-04-10","2014-04-11","2017-11-02 4:18",2014
"1684",117,"Cuban Fury","R",0,"NICOLAS RAPOLD","Wooing the Boss With a Spicy Dance","In “Cuban Fury,” the British comic Nick Frost stars as a former child salsa-dancing champ who brushes up on his skills to woo his new American boss.","2014-04-10","2014-04-11","2017-11-02 4:18",2014
"1685",118,"Captain America: The Winter Soldier","PG-13",0,"MANOHLA DARGIS","Courage, Loyalty, Honor, Kablooey","Producers describe “Captain America: The Winter Soldier,” a sequel in the comic-book-based franchise, as a blend of action film and political thriller.","2014-04-03","2014-04-04","2017-11-02 4:18",2014
"1686",119,"Goodbye World","Not Rated",0,"NICOLAS RAPOLD","Futzing and Flirting as Armageddon Unfolds","In “Goodbye World,” a violent breakdown in society prompts friends to reunite at the home of a couple who live off the grid.","2014-04-03","2014-04-04","2017-11-02 4:18",2014
"1687",120,"10 Rules for Sleeping Around","R",0,"NEIL GENZLINGER","Open Marriage Trying to Induce Same","“10 Rules for Sleeping Around,” about one couple who allow each other to fool around and another that doesn’t, combines nudity and jokes, but fails to be a sex comedy.","2014-04-03","2014-04-04","2017-11-02 4:18",2014
"1688",121,"The Retrieval","R",0,"MANOHLA DARGIS","The Profits and Losses of Fugitive Tracking","In “The Retrieval,” written and directed by Chris Eska, a black youngster working for Civil War bounty hunters helps them capture black fugitives.","2014-04-01","2014-04-02","2017-11-02 4:18",2014
"1689",122,"The Raid 2: Berandal","R",0,"NICOLAS RAPOLD","Nonstop Carnage, Indonesian-Style","Neither the undercover drama in “The Raid 2” nor its two-and-a-half-hour length bog down its numerous bracing and bloody brawls.","2014-03-27","2014-04-11","2017-11-02 4:18",2014
"1690",123,"Savannah","PG-13",0,"NEIL GENZLINGER","Drunk, Ornery and With a Gun in His Hands","“Savannah” tells the story of a well-born Southerner who turns his back on privilege to hunt ducks with a former slave.","2013-08-22","2014-04-25","2017-11-02 4:18",2014
"1691",124,"Under the Electric Sky","PG-13",0,"NICOLAS RAPOLD","Its Devotees Are Diverse, and You Can Dance to It","Short on the business aspects and insights, “Under the Electric Sky” is heavy on the sound and spectacle.","2014-07-24","2014-05-29","2017-11-02 4:18",2014
"1692",125,"The Hornet's Nest","R",0,"DANIEL M. GOLD","Going Into a Taliban Stronghold","“The Hornet’s Nest” follows Mike Boettcher, a broadcast journalist, embedded with American troops in Afghanistan during Operation Strong Eagle III.","2014-05-29","2014-05-09","2017-11-02 4:18",2014
"1693",126,"A Million Ways to Die in the West","R",0,"STEPHEN HOLDEN","A Frontier Farce From the Guy Behind &#8216;Family Guy&#8217; ","The one-man comedy juggernaut Seth MacFarlane directed himself in this western spoof.","2014-05-29","2014-05-30","2017-11-02 4:18",2014
"1694",127,"Maleficent","PG",0,"MANOHLA DARGIS","Dumped by Her Prince, So Watch Out","As the title character in “Maleficent,” Angelina Jolie is the focus of a rethinking of the 1959 Disney animated film “Sleeping Beauty.”","2014-05-29","2014-05-30","2017-11-02 4:18",2014
"1695",128,"Before You Know It","Not Rated",0,"ANDY WEBSTER","When ’70s Guys Hit Their 70s","P J Raval’s documentary “Before You Know It” follows three gay men — in New York, Florida and Texas — as they deal with the common issues of aging.","2014-05-29","2014-05-30","2017-11-02 4:18",2014
"1696",129,"The Love Punch","PG-13",0,"BEN KENIGSBERG","Anything to Save Their Pensions","In the comedy “The Love Punch,” a couple worried about their nest egg decide to steal a diamond.","2014-05-22","2014-05-23","2017-11-02 4:18",2014
"1697",130,"The Angriest Man in Brooklyn","R",0,"NICOLAS RAPOLD","Misdiagnosis? You’d Be Angry, Too","In “The Angriest Man in Brooklyn,” Robin Williams plays a lawyer who reappraises his life when told he has 90 minutes left to live.","2014-05-22","2014-05-23","2017-11-02 4:18",2014
"1698",131,"X-Men: Days of Future Past","PG-13",0,"A. O. SCOTT","Saving Their Future, in Bell-Bottoms","In “X-Men: Days of Future Past,” Wolverine is sent back to the 1970s to round up his young colleagues to help prevent an apocalyptic battle a half-century away.","2014-05-22","2014-05-23","2017-11-02 4:18",2014
"1699",132,"Frequencies","",0,"DANIEL M. GOLD","We Feel Your Vibe","“Frequencies,” written and directed by Darren Paul Fisher, is a sci-fi film with a surreal twist on real life.","2014-05-22","2014-05-23","2017-11-02 4:18",2014
"1700",133,"Blended","PG-13",0,"A. O. SCOTT","When Single Parents Collide on a Safari","In “Blended,” the third pairing of Adam Sandler and Drew Barrymore, Mr. Sandler once again proclaims himself both über-doofus and ultimate mensch.","2014-05-22","2014-05-23","2017-11-02 4:18",2014
"1701",134,"The Immigrant","R",1,"A. O. SCOTT","She’s Just Off the Boat. He’s the Wrong Man.","“The Immigrant” tells the story of a Polish woman’s arrival in New York in 1921 and the complicated scoundrel who forces her into prostitution.","2014-05-15","2014-05-23","2017-11-02 4:18",2014
"1702",135,"The Discoverers","",1,"BEN KENIGSBERG","What Lewis and Clark Inspired","In “The Discoverers,” a history professor takes his children on a family-fraught trip with historical re-enactors.","2014-05-15","2014-05-16","2017-11-02 4:18",2014
"1703",136,"Hanna Ranch","Not Rated",1,"ANDY WEBSTER","On the Range, With a Conscience","Kirk Hanna, the focus of the documentary “Hanna Ranch,” appeared in “Fast Food Nation.”","2014-05-15","2014-05-16","2017-11-02 4:18",2014
"1704",137,"Chinese Puzzle","R",1,"STEPHEN HOLDEN","Love, Sex, Marriage and Schopenhauer’s Ghost","“Chinese Puzzle,” the third film in a trilogy, centers on a womanizing Frenchman who follows his ex-wife to New York.","2014-05-15","2014-05-16","2017-11-02 4:18",2014
"1705",138,"The American Nurse","",0,"ANITA GATES","Attending Life’s First Breath and Its Last","The documentary “The American Nurse,” a tribute to the profession, focuses on five who work across life’s spectrum, from labor and delivery to hospice.","2014-05-15","2014-05-08","2017-11-02 4:18",2014
"1706",139,"Million Dollar Arm","PG",0,"STEPHEN HOLDEN","Hapless Meal Tickets, Plucked From India","“Million Dollar Arm” centers on a self-centered sports agent who recruits potential major league pitchers in India.","2014-05-15","2014-05-16","2017-11-02 4:18",2014
"1707",140,"Godzilla","PG-13",0,"A. O. SCOTT","Still Radioactive and Spoiling for a Fight","Godzilla, everybody’s favorite skyscraper stomper, returns in a remake directed by Gareth Edwards, and he’s showing some familiar generational traits.","2014-05-15","2014-05-16","2017-11-02 4:18",2014
"1708",141,"Half of a Yellow Sun","R",0,"BEN KENIGSBERG","In Nigeria, the Personal and the Political Clash","Chiwetel Ejiofor and Thandie Newton star in “Half of a Yellow Sun,” set during the 1960s in a newly independent Nigeria.","2014-05-15","2014-05-16","2017-11-02 4:18",2014
"1709",142,"Moms' Night Out","PG",0,"NEIL GENZLINGER","Dad’s Watching Us? Call Social Services","In “Moms’ Night Out,” hapless fathers assume command after the women in their lives decide that they need a restaurant outing.","2014-05-08","2014-05-09","2017-11-02 4:18",2014
"1710",143,"Legends of Oz: Dorothy's Return","PG",0,"NICOLAS RAPOLD","Wicked Witch Is Dead, but Here Comes a Jester","A cast of familiar characters embarks on a rescue mission in the animated “Legends of Oz: Dorothy’s Return.”","2014-05-08","2014-05-09","2017-11-02 4:18",2014
"1711",144,"Farmland","",0,"JEANNETTE CATSOULIS","Young Hands Steering the Family Tractor","“Farmland,” a documentary by James Moll, profiles six family farms and the young people who now run them.","2014-05-08","2014-05-01","2017-11-02 4:18",2014
"1712",145,"Chef","R",0,"STEPHEN HOLDEN","Man in the Kitchen Is Hungry for Love","In “Chef,” the director and writer Jon Favreau plays a high-end Los Angeles chef whose rise to gastronomic stardom is abruptly ended by a restaurant critic.","2014-05-08","2014-05-30","2017-11-02 4:18",2014
"1713",146,"Neighbors","R",0,"A. O. SCOTT","Just Try Borrowing a Cup of Sugar","In “Neighbors,” a young married couple start to feel old living next to a house full of hard-partying fraternity brothers, and turf war breaks out.","2014-05-08","2014-05-09","2017-11-02 4:18",2014
"1714",147,"NOW: In the Wings on a World Stage","Not Rated",0,"DAVID DeWITT","Kevin Spacey and Company Hit the Road","“NOW” follows Kevin Spacey and his fellow actors in a production of “Richard III” that is staged around the world, from Beijing to Brooklyn.","2014-05-01","2014-05-02","2017-11-02 4:18",2014
"1715",148,"The Protector 2","R",0,"DANIEL M. GOLD","A Man and His Elephant, and Flying Fists","A sequel to “The Protector” revolves around another kidnapping of the sacred elephant Khon.","2014-05-01","2014-05-02","2017-11-02 4:18",2014
"1716",149,"Friended to Death","R",0,"BEN KENIGSBERG","Insert an Emoticon Here","The comedy “Friended to Death” uses a noxious protagonist to look at social media.","2014-05-01","2014-05-02","2017-11-02 4:18",2014
"1717",150,"Pour une femme","",0,"RACHEL SALTZ","Revisiting Familial Territory","The French director Diane Kurys has a penchant for working and reworking the story of her parents.","2014-05-01","2014-05-02","2017-11-02 4:18",2014
"1718",151,"Decoding Annie Parker","R",0,"STEPHEN HOLDEN","On the Trail of a Gene That Kills","“Decoding Annie Parker” follows two roads to the discovery of a genetic link to breast cancer: A Canadian woman with numerous dead relatives and the same disease that killed them, and a scientist doggedly working on a far-fetched theory.","2014-05-01","2014-05-02","2017-11-02 4:18",2014
"1719",152,"Bad Johnson","",0,"NEIL GENZLINGER","A Penis With a Mind of Its Own","Be careful what you wish for: A man tired of the way his lust runs his life ends up with a renegade, human-form penis in the sex farce “Bad Johnson.”","2014-05-01","2014-05-02","2017-11-02 4:18",2014
"1720",153,"The Amazing Spider-Man 2","PG-13",0,"MANOHLA DARGIS","Hey, Evildoers, Here’s Webbing in Your Eye","Peter Parker wrestles with relationship troubles between bouts with the Green Goblin and Gwen Stacy in “The Amazing Spider-Man 2,” which introduces Jamie Foxx as the villain Electro.","2014-05-01","2014-05-02","2017-11-02 4:18",2014
"1721",154,"Altered States of Plaine","",0,"BEN KENIGSBERG","The Mysterious Adventure of the Good Night’s Sleep","In “Altered States of Plaine,” the protagonist finds himself in a new location, without any sense of how he got there, any time he dozes off.","2014-05-01","2014-05-02","2017-11-02 4:18",2014
"1722",155,"The Railway Man","R",0,"STEPHEN HOLDEN","Lifetime Anguish Is the High Cost of Courage","Colin Firth stars as Eric Lomax, a British Army officer who served and suffered during World War II, in this movie based on Lomax’s memoir.","2014-04-10","2014-05-23","2017-11-02 4:18",2014
"1723",156,"The Supreme Price","",0,"ANITA GATES","Nigeria: One Family&#8217;s Bittersweet Reflection ","&#8220;The Supreme Price,&#8221; directed by Joanna Lipper, depicts Nigeria&#8217;s Abiola family as all-too-human leaders of a democracy movement.","2014-10-02","2014-06-01","2017-11-02 4:18",2014
"1724",157,"Transformers: Age of Extinction","PG-13",0,"A. O. SCOTT","Let the Mass Destruction Begin","“Transformers: Age of Extinction” is an action-packed movie with thunderous showers of metal, glass, masonry and earth.","2014-06-26","2014-06-27","2017-11-02 4:18",2014
"1725",158,"Radio Free Albemuth","R",0,"JEANNETTE CATSOULIS","Secrets of the Universe, Embedded in Pop Ditties","In the science-fiction movie “Radio Free Albemuth,” based on a book by Philip K. Dick, humans receive secret communications from an extraterrestrial source as they endure despotic rule.","2014-06-26","2014-06-27","2017-11-02 4:18",2014
"1726",159,"Jackpot","Not Rated",0,"BEN KENIGSBERG","Comedy and Carnage","“Jackpot” is a throwback to the “Pulp Fiction”-style deadpan noirs that proliferated in the 1990s.","2014-06-26","2014-06-27","2017-11-02 4:18",2014
"1727",160,"The Pleasures of Being Out of Step","",0,"NICOLAS RAPOLD","From Liner Notes to Front Lines of Advocacy","“The Pleasures of Being Out of Step” is a documentary about the music critic and First Amendment defender Nat Hentoff.","2014-06-24","2014-06-25","2017-11-02 4:18",2014
"1728",161,"A Summer's Tale","G",1,"STEPHEN HOLDEN","Torn by Three Loves and Styles of Jousting","Eric Rohmer’s languid 1996 film, “A Summer’s Tale,” finally released in the United States, focuses on a young man vacationing in Brittany who feels torn among three women.","2014-06-19","2014-06-20","2017-11-02 4:18",2014
"1729",162,"Think Like a Man Too","PG-13",0,"ANITA GATES","What Happens in Vegas ...","Things turn loud and desperate in “Think Like a Man Too,” the sequel to the Steve Harvey-inspired movie.","2014-06-19","2014-06-20","2017-11-02 4:18",2014
"1730",163,"The Last Sentence","",0,"MANOHLA DARGIS","After Challenging Hitler, It All Goes to the Dogs","“The Last Sentence” is a fictionalization of how the Swedish journalist Torgny Segerstedt positioned himself on the right side of history by writing an editorial that declared “Herr Hitler is an insult.”","2014-06-19","2014-06-20","2017-11-02 4:18",2014
"1731",164,"Miss Lovely","",0,"NICOLAS RAPOLD","The Ugly Side of Bollywood","In “Miss Lovely,” Ashim Ahluwalia shoves us into a 1980s demimonde of quick-and-dirty Indian exploitation movies, run by gangsters and sweatily intertwined with the sex trade.","2014-06-19","2014-06-20","2017-11-02 4:18",2014
"1732",165,"Jersey Boys","R",0,"MANOHLA DARGIS","You’re Just Too Good to Be True","Clint Eastwood’s “Jersey Boys,” the adaptation of the Broadway musical, is a redemption narrative that’s got a good beat.","2014-06-19","2014-06-20","2017-11-02 4:18",2014
"1733",166,"The Chef","PG-13",0,"BEN KENIGSBERG","Every Dish Is a Plat du Jour","“Le Chef” is an odd-couple farce about a stern celebrity chef and the authority-flouting understudy who cooks his own way.","2014-06-19","2014-06-20","2017-11-02 4:18",2014
"1734",167,"The Rover","R",0,"A. O. SCOTT","A Car Is Stolen, Setting Off an Angry Pursuit","In “The Rover,” set in a bleak Australia, a man sets out for revenge after thugs take his vehicle.","2014-06-12","2014-06-20","2017-11-02 4:18",2014
"1735",168,"Lullaby","R",0,"STEPHEN HOLDEN","One Generation Passes; Another One Grumbles","An obnoxious young man learns life lessons as his father nears death in “Lullaby,” the directorial debut of Andrew Levitas.","2014-06-12","2014-06-13","2017-11-02 4:18",2014
"1736",169,"How to Train Your Dragon 2","PG",0,"STEPHEN HOLDEN","He’s a Great Pet, Even if He Does Singe Your Hair","“How to Train Your Dragon 2,” the sequel to the 2010 blockbuster from DreamWorks Animation, is considerably darker and more self-aware than its forerunner.","2014-06-12","2014-06-13","2017-11-02 4:18",2014
"1737",170,"I Am I","",0,"ANDY WEBSTER","A Woman Is Courted, but the Suitor Is Her Father","The daughter of the screenwriter Roger Towne directs, writes and stars in her own film, “I Am I.”","2014-06-12","2014-06-13","2017-11-02 4:18",2014
"1738",171,"A Coffee in Berlin","Not Rated",0,"RACHEL SALTZ","A Young Man’s Dark-Roasted Day","“A Coffee in Berlin,” Jan Ole Gerster’s feature film debut, follows a young man’s twisting path.","2014-06-12","2014-06-13","2017-11-02 4:18",2014
"1739",172,"22 Jump Street","R",0,"MANOHLA DARGIS","Just Like the Last One, Only Different","In “22 Jump Street,” Jonah Hill and Channing Tatum reprise their role as police partners, this time going undercover on a college campus.","2014-06-12","2014-06-13","2017-11-02 4:18",2014
"1740",173,"Trust Me","R",0,"STEPHEN HOLDEN","It Takes Some Heat to Create Movie Stars","“Trust Me,” written and directed by Clark Gregg, stars Mr. Gregg as a scuffling, obsequious agent specializing in child actors.","2014-06-05","2014-06-06","2017-11-02 4:18",2014
"1741",174,"Edge of Tomorrow","PG-13",0,"MANOHLA DARGIS","Killed in Action by Aliens, Over and Over Again","In “Edge of Tomorrow,” Tom Cruise plays a military man caught in a time loop, destined to battle invading aliens day after day in a repeating bid to save Earth from Armageddon.","2014-06-05","2014-06-06","2017-11-02 4:18",2014
"1742",175,"This is Not a Ball","",0,"NICOLE HERRINGTON","A Passionate Symbol, Even Without the World Cup","“This Is Not a Ball” is a soccer documentary that focuses primarily on the ball itself.","2014-06-05","2014-06-06","2017-11-02 4:18",2014
"1743",176,"The Fault in Our Stars","PG-13",0,"A. O. SCOTT","Young Love, Complicated by Cancer","In “The Fault in Our Stars,” a film based on the young-adult novel, two teenagers with cancer fall in love and grasp the meaning of their lives earlier than usual.","2014-06-05","2014-06-06","2017-11-02 4:18",2014
"1744",177,"Rigor Mortis","",0,"DANIEL M. GOLD","Bringing Blood to the Neighborhood","The Hong Kong horror film “Rigor Mortis” puts an actor through an exorcism.","2014-06-05","2014-06-06","2017-11-02 4:18",2014
"1745",178,"Filmistaan","",0,"BEN KENIGSBERG","Crossing Borders Through Cinema","In “Filmistaan,” an aspiring actor tries to bridge political differences when he is mistakenly captured by extremists.","2014-06-05","2014-06-06","2017-11-02 4:18",2014
"1746",179,"Burning Blue","R",0,"ANITA GATES","Navy Pilots Under the Gun","In D M W Greer’s “Burning Blue,” Navy fighter pilots become the focus of an investigation that exposes a homosexual affair.","2014-06-05","2014-06-06","2017-11-02 4:18",2014
"1747",180,"War Story","",0,"JEANNETTE CATSOULIS","She Has Seen Too Much, and It Shows","“War Story” centers on an overseas American photographer with a damaged psyche.","2014-07-29","2014-07-30","2017-11-02 4:18",2014
"1748",181,"Hercules","PG-13",0,"BEN KENIGSBERG","All Tribalism and Treachery, Dude","Dwayne Johnson plays the title role in “Hercules,” a piece of tongue-in-cheek revisionist mythology directed by Brett Ratner.","2014-07-25","2014-07-25","2017-11-02 4:18",2014
"1749",182,"Lucy","R",0,"MANOHLA DARGIS","Deep in Her Gut, She Knows She&#8217;s Not Ordinary","Luc Besson’s new film, “Lucy,” turns Scarlett Johansson from a frowzy, cheerful young woman into a killing machine.","2014-07-24","2014-07-25","2017-11-02 4:18",2014
"1750",183,"And So it Goes","PG-13",0,"NICOLAS RAPOLD","When Grumpy Met Sappy","Michael Douglas plays a crabby old guy who gets together with his next-door neighbor (Diane Keaton) in the comedy “And So It Goes.”","2014-07-24","2014-07-25","2017-11-02 4:18",2014
"1751",184,"Wish I Was Here","R",0,"STEPHEN HOLDEN","For a Struggling Actor, New Roles","“Wish I Was Here” looks at a middle-class family forced to change its ways by the costly illness of its patriarch.","2014-07-17","2014-07-25","2017-11-02 4:18",2014
"1752",185,"Video Games: The Movie","",0,"JEANNETTE CATSOULIS","A Long and Winding History of Gaming","In “Video Games: The Movie,” dozens of celebrities and game developers, among others, explore the history and impact of video games on society.","2014-07-17","2014-07-18","2017-11-02 4:18",2014
"1753",186,"The Purge: Anarchy","R",0,"MANOHLA DARGIS","Pay Your Taxes, Kill the Neighbors","In “The Purge: Anarchy,” Americans are again asked to spend a night running amok and killing.","2014-07-17","2014-07-18","2017-11-02 4:18",2014
"1754",187,"Sex Tape","R",0,"A. O. SCOTT","Oops! Pushed the Wrong Button","Jason Segel and Cameron Diaz star as a married couple who scramble to keep their homemade erotic video private in “Sex Tape.”","2014-07-17","2014-07-18","2017-11-02 4:18",2014
"1755",188,"Planes: Fire and Rescue","PG",0,"BEN KENIGSBERG","Fire Flight","In “Planes: Fire & Rescue” a crop-dusting plane embarks on a second career as a firefighter.","2014-07-17","2014-07-18","2017-11-02 4:18",2014
"1756",189,"Persecuted","PG-13",0,"NEIL GENZLINGER","They’re Out to Get Him, Whoever They Are","“Persecuted” finds a television evangelist holding out against a vaguely defined piece of legislation.","2014-07-17","2014-07-18","2017-11-02 4:18",2014
"1757",190,"Mood Indigo","Not Rated",0,"MANOHLA DARGIS","As Boy Woos Girl, Whimsy Is in the Picture","In “Mood Indigo,” Audrey Tautou and Romain Duris star in a whimsical love story adapted from the French novel “L’Écume des Jours.”","2014-07-17","2014-07-18","2017-11-02 4:18",2014
"1758",191,"Fanny","Not Rated",0,"BEN KENIGSBERG","Three Fathers Make an Impression","Marius, his father and the sailmaker who marries the pregnant title character fuel &#8220;Fanny,&#8221; the middle film of a trilogy.","2014-07-17","2014-07-18","2017-11-02 4:18",2014
"1759",192,"Among Ravens","",0,"BEN KENIGSBERG","A Family Gathers, and So Does the Dysfunction","In “Among Ravens,” relatives and their problems gather at a Fourth of July getaway.","2014-07-17","2014-07-18","2017-11-02 4:18",2014
"1760",193,"Dawn of the Planet of the Apes","PG-13",1,"A. O. SCOTT"," Neighbors Who Need Good Fences","In “Dawn of the Planet of the Apes,” civilized apes and devastated humans debate what to do about each other.","2014-07-10","2014-07-11","2017-11-02 4:18",2014
"1761",194,"Underwater Dreams","",0,"DAVID DeWITT","For One Team, It’s Sink or Swim","Students from a low-income high school in Arizona win a robotics competition and reflect on their victory in “Underwater Dreams.”","2014-07-10","2014-07-11","2017-11-02 4:18",2014
"1762",195,"Road to Paloma","R",0,"JEANNETTE CATSOULIS","A Fugitive Who Stops to Smell the Flowers","In “Road to Paloma,” Jason Momoa plays a Native American whose act of retribution sets the F.B.I. on his trail.","2014-07-10","2014-07-11","2017-11-02 4:18",2014
"1763",196,"Affluenza","Not Rated",0,"BEN KENIGSBERG","If Gatsby Were Coming of Age Today ...","In “Affluenza,” Kevin Asch’s take on millennials, pot, sex and golf are plentiful, but everyone continues to sulk.","2014-07-10","2014-07-11","2017-11-02 4:18",2014
"1764",197,"Beyond the Edge","",1,"BEN KENIGSBERG","Those 3-D Effects Are the Bee’s Knees","With re-enactments and archival material, Leanne Pooley recounts Edmund Hillary and Tenzing Norgay’s ascent of Mount Everest.","2014-07-03","2014-07-04","2017-11-02 4:18",2014
"1765",198,"Marius","Not Rated",0,"BEN KENIGSBERG","Wanderlust as the Enemy of Love","Daniel Auteuil has brought “Marius,” the first part of a trilogy by Marcel Pagnol, back to the screen in a remake, with two more films to follow.","2014-07-03","2014-07-04","2017-11-02 4:18",2014
"1766",199,"Deliver Us From Evil","R",1,"NEIL GENZLINGER","A New York Cop Walks the Satan Beat","A New York police officer teams up with a priest to combat demonic possession in the horror movie “Deliver Us From Evil.”","2014-07-01","2014-07-02","2017-11-02 4:18",2014
"1767",200,"Premature","R",0,"NICOLAS RAPOLD","More Than One Shot at a Good Day","In the teenage-sex comedy “Premature,” a boy’s ejaculations jump-start his morning.","2014-07-01","2014-07-02","2017-11-02 4:18",2014
"1768",201,"Tammy","R",0,"MANOHLA DARGIS","When Life Offers Lemons, Zest Them","“Tammy,” a road movie starring Melissa McCarthy, is notable for actors who look like real, actual-size people.","2014-07-01","2014-07-02","2017-11-02 4:18",2014
"1769",202,"Earth to Echo","PG",0,"NICOLAS RAPOLD","In the Suburban Night, a Creature Awaits","In “Earth to Echo,” young friends out for a night of fun in their Nevada surroundings come across an alien robot.","2014-07-01","2014-07-02","2017-11-02 4:18",2014
"1770",203,"Begin Again","R",0,"A. O. SCOTT","The Genre, if Not the Song, Remains the Same","“Begin Again,” starring Keira Knightley, Mark Ruffalo and Adam Levine, is the director John Carney’s follow-up to “Once.”","2014-06-26","2014-07-11","2017-11-02 4:18",2014
