"","X","display_title","mpaa_rating","critics_pick","byline","headline","summary_short","publication_date","opening_date","date_updated","openingyear"
"598",63,"Tumbledown","R",0,"NICOLAS RAPOLD","Review: In ‘Tumbledown,’ a Book Is the Third Party in a Love Triangle","Rebecca Hall plays the young grieving widow of an acclaimed indie-folk singer and Jason Sudeikis his brash biographer in this dramedy directed by Sean Mewshaw.","2016-02-04","2016-02-05","2017-11-02 4:18",2016
"599",64,"The Choice","PG-13",0,"JEANNETTE CATSOULIS","Review: In ‘The Choice,’ a Sudsy Romance That Was Meant to Be","Based on a book by Nicholas Sparks, the film stars Teresa Palmer and Benjamin Walker as a pair who fall in love amid rain-soaked trysts and ocean sunsets.","2016-02-04","2016-02-05","2017-11-02 4:18",2016
"600",65,"Southbound","R",0,"NEIL GENZLINGER","Review: ‘Southbound’ Tells Five Horror Tales, All Set on a Desolate Highway","This anthology film, by the directors Roxanne Benjamin, David Bruckner, Patrick Horvath and the collective Radio Silence, presents characters who need to escape (and can’t).","2016-02-04","2016-02-05","2017-11-02 4:18",2016
"601",66,"Pride and Prejudice and Zombies","PG-13",0,"MANOHLA DARGIS","Review: ‘Pride and Prejudice and Zombies’; More Tea, Dear?","In this undead ravishing of the Jane Austen novel, Elizabeth Bennet must deal with creatures much, much worse than Mr. Darcy.","2016-02-04","2016-02-05","2017-11-02 4:18",2016
"602",67,"Hail, Caesar!","PG-13",0,"MANOHLA DARGIS","Review: In ‘Hail, Caesar!’ the Coens Revisit Old Hollywood","Joel and Ethan Coen meander in and around their Tinseltown dream factory cracking jokes in a film set a decade after Barton Fink’s meltdown.","2016-02-04","2016-02-05","2017-11-02 4:18",2016
"603",68,"Only Yesterday","PG",0,"NICOLAS RAPOLD","Review: ‘Only Yesterday,’ Isao Takahata’s Time-Jumping Anime","Mr. Takahata’s 1991 feature about a woman and her younger self gets a new voice cast (including Daisy Ridley) for its release in the United States.","2015-12-31","2016-02-26","2017-11-02 4:18",2016
"604",69,"Boone","",0,"BEN KENIGSBERG","Review: Lovingly Tending the Livestock in ‘Boone’","A documentary observes life — births, milking and vegetable picking — on a goat farm in Oregon.","2017-04-27","2016-03-01","2017-11-02 4:18",2016
"605",70,"Disturbing the Peace","",1,"ANDY WEBSTER","Review: ‘Disturbing the Peace’ Profiles Israelis and Palestinians United Against Violence","Combatants for Peace, a group of individuals including many former military enemies in the Middle East, seeks solutions to the region’s agonized convulsions.","2016-11-10","2016-03-10","2017-11-02 4:18",2016
"606",71,"Making a Killing","",0,"KEN JAWOROWSKI","Review: In ‘Making a Killing,’ Guns Do Slay People, Children Included","This documentary focuses on the role of the National Rifle Association in blocking legislation to tighten gun laws.","2016-08-18","2016-03-15","2017-11-02 4:18",2016
"607",72,"Fastball","Not Rated",1,"NEIL GENZLINGER","Review: ‘Fastball,’ on the Mechanics and Poetry of a Pitch","This documentary, written and directed by Jonathan Hock, offers a batter’s point of view on trying to hit a superior fastball.","2016-03-24","2016-03-25","2017-11-02 4:18",2016
"608",73,"Born to Be Blue","R",1,"STEPHEN HOLDEN","Review: ‘Born to Be Blue,’ Portrait of a Trumpeter as a Heroin Addict","Ethan Hawke plays Chet Baker in this extended riff on a jazz life written and directed by Robert Budreau.","2016-03-24","2016-03-25","2017-11-02 4:18",2016
"609",74,"I Saw the Light","R",0,"MANOHLA DARGIS","Review: ‘I Saw the Light,’ a Hank Williams Biopic","The British actor Tom Hiddleston stars (and sings) as the music legend, leading with charm and a twang in this film written and directed by Marc Abraham.","2016-03-24","2016-03-25","2017-11-02 4:18",2016
"610",75,"They’re Watching","",0,"NEIL GENZLINGER","Review: ‘They’re Watching,’ and Reality TV Is Capturing Every Eerie Second","This found-footage horror film from Micah Wright and Jay Lender separates itself from much of the genre’s low-budget fare with its amusing premise.","2016-03-24","2016-03-25","2017-11-02 4:18",2016
"611",76,"Jane Wants a Boyfriend","",0,"ANDY WEBSTER","Review: ‘Jane Wants a Boyfriend’ Looks at Autism Through a Sister’s Eyes","This William C. Sullivan film follows a 20-something with autism as she searches for a significant other under her sister’s protective watch.","2016-03-24","2016-03-25","2017-11-02 4:18",2016
"612",77,"My Big Fat Greek Wedding 2","PG-13",0,"JEANNETTE CATSOULIS","Review: ‘My Big Fat Greek Wedding 2’ Is Something Tired, Something New","This long-awaited sequel to the hit romantic comedy, again written by and starring Nia Vardalos, is a washed-out recycling of ethnic clichés and exhausted jokes.","2016-03-24","2016-03-25","2017-11-02 4:18",2016
"613",78,"Batman v Superman: Dawn of Justice","PG-13",0,"A. O. SCOTT","Review: ‘Batman v Superman’ ... v Fun?","The film, pitting Ben Affleck against Henry Cavill, largely serves as an extended trailer for a slate of coming DC Comics movies like “Wonder Woman.”","2016-03-23","2016-03-25","2017-11-02 4:18",2016
"614",79,"Kapoor & Sons — Since 1921","",0,"RACHEL SALTZ","Review: ‘Kapoor &amp; Sons’ Centers on an Indian Family’s Flaws","This film, directed by Shakun Batra, features comedy, drama, money troubles and at least one secret.","2016-03-20","2016-03-18","2017-11-02 4:18",2016
"615",80,"The Confirmation","PG-13",1,"ANDY WEBSTER","Review: In ‘The Confirmation,’ a Troubled Father and Tender Son Bond","This Bob Nelson character study stars Clive Owen as a troubled handyman who has more than stolen tools on his mind.","2016-03-17","2016-03-18","2017-11-02 4:18",2016
"616",81,"Everything Is Copy","",1,"JEANNETTE CATSOULIS","Review: ‘Everything Is Copy,’ a Son’s Tribute to Nora Ephron","Celebrities and family members discuss and honor Ephron’s tartness in this documentary from Jacob Bernstein.","2016-03-17","2016-03-21","2017-11-02 4:18",2016
"617",82,"Krisha","R",1,"MANOHLA DARGIS","Review: ‘Krisha,’ a Family Drama Set Around Thanksgiving","A house in Texas becomes the site of a woman’s undoing in Trey Edward Shults’s film.","2016-03-17","2016-03-18","2017-11-02 4:18",2016
"618",83,"My Golden Days","R",1,"MANOHLA DARGIS","Review: In ‘My Golden Days,’ Aching for a Love Left Behind","Arnaud Desplechin’s film tells of a middle-aged anthropologist and the women who left their imprint on different stages of his life.","2016-03-17","2016-03-18","2017-11-02 4:18",2016
"619",84,"The Preppie Connection","R",0,"HELEN T. VERONGOS","Review: In ‘The Preppie Connection,’ Drug Smuggling at an Elite School","This film is inspired by events in 1984 at Choate Rosemary Hall in Connecticut, where a student was accused of smuggling cocaine to sell to classmates.","2016-03-17","2016-03-18","2017-11-02 4:18",2016
"620",85,"Ktown Cowboys","R",0,"NEIL GENZLINGER","Review: In ‘Ktown Cowboys,’ Men on the Prowl in Koreatown","Based on a popular web series, the film follows characters sampling various kinds of night life in Los Angeles as grown-up problems hover.","2016-03-17","2016-03-18","2017-11-02 4:18",2016
"621",86,"The Birth of Sake","",0,"DANIEL M. GOLD","Review: In ‘The Birth of Sake,’ a Brew Made With Pride and Lots of Patience","Erik Shirai’s documentary opens a window into the unhurried and elaborate making of the Japanese liquor at a family-owned brewery.","2016-03-17","2016-03-18","2017-11-02 4:18",2016
"622",87,"The Bronze","R",0,"NEIL GENZLINGER","Review: In ‘The Bronze,’ a Former Gymnast Has Losing Ways","Melissa Rauch stars in this comedy about an Olympic medalist who is defined by her spitefulness and jealousy.","2016-03-17","2016-03-18","2017-11-02 4:18",2016
"623",88,"The Program","R",0,"STEPHEN HOLDEN","Review: ‘The Program,’ a Docudrama on the Fall of Lance Armstrong","In this Stephen Frears film, Ben Foster plays Armstrong, the cyclist disgraced and stripped of victories after a doping scandal.","2016-03-17","2016-03-18","2017-11-02 4:18",2016
"624",89,"Midnight Special","PG-13",0,"A. O. SCOTT","Review: In ‘Midnight Special,’ on the Run With a Highly Unusual Child","Jeff Nichols’s film keeps you guessing as you follow two apparent outlaws fleeing federal agents with a young boy who has special talents.","2016-03-17","2016-03-18","2017-11-02 4:18",2016
"625",90,"Allegiant","PG-13",0,"JEANNETTE CATSOULIS","Review: ‘Allegiant’ Diverges as the End Nears","“Allegiant,” the first part of the “Divergent” series finale, takes moviegoers to the creepy confines of the Bureau of Genetic Welfare.","2016-03-17","2016-03-18","2017-11-02 4:18",2016
"626",91,"Fireworks Wednesday","",1,"STEPHEN HOLDEN","Review: ‘Fireworks Wednesday,’ a Domestic Drama From Iran","Asghar Farhadi’s film, set during the boisterous New Year celebrations in Tehran, dissects the imploding marriage of an affluent couple.","2016-03-15","2016-03-16","2017-11-02 4:18",2016
"627",92,"Miracles From Heaven","PG",0,"KEN JAWOROWSKI","Review: ‘Miracles From Heaven,’ Starring Jennifer Garner as the Mother of a Sick Child","This deus-ex-machina tale, based on Christy Beam’s memoir, centers on a family whose faith is tested by a daughter’s illness.","2016-03-15","2016-03-16","2017-11-02 4:18",2016
"628",93,"The Young Messiah","PG-13",0,"ANDY WEBSTER","Review: ‘The Young Messiah’ Depicts Jesus as a Boy Discovering His Powers","Cyrus Nowrasteh’s film hits some New Testament basics as it depicts the flight of Joseph, Mary and their son from Alexandria, Egypt, to Nazareth and eventually to Jerusalem.","2016-03-13","2016-03-11","2017-11-02 4:18",2016
"629",94,"The Perfect Match","R",0,"GLENN KENNY","Review: In ‘The Perfect Match,’ Weddings, Babies and One Bachelor Holdout","Bille Woodruff’s circle-of-friends romantic comedy puts a commitment-phobic Los Angeles talent agent in the path of a ravishing mystery woman.","2016-03-11","2016-03-11","2017-11-02 4:18",2016
"630",95,"Marguerite","R",1,"STEPHEN HOLDEN","Review: ‘Marguerite,’ a Screeching Diva Clinging to Her Operatic Dream","Xavier Giannoli’s comedy, inspired by the life of the talentless American socialite Florence Foster Jenkins, stars Catherine Frot as an aspiring singer.","2016-03-10","2016-03-11","2017-11-02 4:18",2016
"631",96,"Boom Bust Boom","",1,"KEN JAWOROWSKI","Review: ‘Boom Bust Boom,’ a Pythonesque Look at Financial Crashes","This film by Terry Jones, formerly of Monty Python, explores the 2008 financial collapse and the possibility of more crashes through animation, puppetry and interviews with economists.","2016-03-10","2016-03-11","2017-11-02 4:18",2016
"632",97,"10 Cloverfield Lane","PG-13",1,"JEANNETTE CATSOULIS","Review: ‘10 Cloverfield Lane’ Houses a Survivalist, His Captive and Jolts","J.J. Abrams produced but did not direct this thriller, which is only slightly connected to his “Cloverfield” (2008) and stars Mary Elizabeth Winstead.","2016-03-10","2016-03-11","2017-11-02 4:18",2016
"633",98,"Eye in the Sky","R",1,"STEPHEN HOLDEN","Review: ‘Eye in the Sky,’ Drone Precision vs. Human Failings","Gavin Hood’s movie is a riveting thriller — and often a grim, suspenseful farce — about drone warfare and its perils.","2016-03-10","2016-03-11","2017-11-02 4:18",2016
"634",99,"City of Gold","R",1,"A. O. SCOTT","Review: Tastes of Los Angeles in ‘City of Gold’","Laura Gabbert’s documentary follows the food critic Jonathan Gold in his pursuit of excellence, which can lead to a taco truck or a high-end restaurant.","2016-03-10","2016-03-11","2017-11-02 4:18",2016
"635",100,"Me Him Her","",0,"MIKE HALE","Review: In ‘Me Him Her,’ Late-20-Somethings Emerge From Life’s Confusion","A loose indie comedy, this feature debut from Max Landis shows the mark of the 1985 cult classic “Into the Night,” made by his father, John Landis.","2016-03-10","2016-03-11","2017-11-02 4:18",2016
"636",101,"Creative Control","R",0,"JEANNETTE CATSOULIS","Review: ‘Creative Control,’ a Satire of Gadget-Driven Reality","Benjamin Dickinson’s sophomore feature stars Mr. Dickinson as a stressed-out adman, an unprepossessing antihero with no control at all.","2016-03-10","2016-03-11","2017-11-02 4:18",2016
"637",102,"Lolo","",0,"NICOLAS RAPOLD","Review: In Julie Delpy’s ‘Lolo,’ a Teenager Tries to Sabotage His Mother’s Romance","Ms. Delpy plays an indulgent divorced parent whose chance at happiness is threatened by her spoiled and scheming son.","2016-03-10","2016-03-01","2017-11-02 4:18",2016
"638",103,"About Scout","",0,"NEIL GENZLINGER","Review: In ‘About Scout,’ a Young Woman Searches for Her Sister","Scout recruits a traveling companion from a psychiatric care center to search for her younger sister, who has been taken by their absentee father.","2016-03-10","2016-03-11","2017-11-02 4:18",2016
"639",104,"The Brothers Grimsby","R",0,"MANOHLA DARGIS","Review: ‘The Brothers Grimsby’: From Sacha, With Love","Sacha Baron Cohen returns with a movie about two brothers — a sleek superspy and a bumbling fool — who battle a global crime syndicate.","2016-03-10","2016-03-11","2017-11-02 4:18",2016
"640",105,"Rise of the Legend","",0,"ANDY WEBSTER","Review: ‘Rise of the Legend,’ a Kung Fu Period Film","In 19th-century Guangzhou, two friends who have trained together, and pine for the same woman, are on opposite sides of a battle.","2016-03-10","2016-03-11","2017-11-02 4:18",2016
"641",106,"Hello, My Name Is Doris","R",0,"MANOHLA DARGIS","Review: ‘Hello, My Name Is Doris,’ About an Older Woman’s Love for a Much Younger Man","A frumpy, lower-middle-class woman in her 60s suddenly finds herself desired, which leads to a ferocious awakening.","2016-03-10","2016-03-11","2017-11-02 4:18",2016
"642",107,"Here Come the Videofreex","Not Rated",0,"GLENN KENNY","Review: ‘Here Come the Videofreex,’ Revolution via the Portapak","This concise and informative documentary follows the early adopters of a lightweight record-playback model by Sony in 1968.","2016-03-08","2016-03-09","2017-11-02 4:18",2016
"643",108,"Zootopia","PG",1,"NEIL GENZLINGER","Review: In ‘Zootopia,’ an Intrepid Bunny Chases Her Dreams","As the first rabbit police officer in Zootopia, Judy Hopps is stuck writing parking tickets, but the ambitious bunny pokes her nose into a missing-mammal epidemic.","2016-03-03","2016-03-04","2017-11-02 4:18",2016
"644",109,"They Will Have to Kill Us First","",0,"JEANNETTE CATSOULIS","Review: ‘They Will Have to Kill Us First’ Documents Malian Music in Exile","Johanna Schwartz’s film follows musicians in exile after Islamic jihadists banned music in their home country.","2016-03-03","2016-03-04","2017-11-02 4:18",2016
"645",110,"Ava’s Possessions","R",0,"JEANNETTE CATSOULIS","Review: In ‘Ava’s Possessions,’ Fallout From a Lost Month of Demonic Activity","There is a mysterious bloodstain beneath Ava’s rug, and there are criminal charges for assault and indecent exposure to be faced.","2016-03-03","2016-03-04","2017-11-02 4:18",2016
"646",111,"Road Games","",0,"NICOLAS RAPOLD","Review: In ‘Road Games,’ a French Hitch Turns South","Abner Pastoll’s thriller focuses on two hitchhikers and the eccentric motorist who picks them up.","2016-03-03","2016-03-04","2017-11-02 4:18",2016
"647",112,"London Has Fallen","R",0,"NEIL GENZLINGER","Review: In ‘London Has Fallen,’ the President Must Be Saved From Terrorists","Aaron Eckhart plays American’s leader visiting London, and Gerard Butler is his Secret Service protector when bloody chaos erupts.","2016-03-03","2016-03-04","2017-11-02 4:18",2016
"648",113,"The Wave","R",0,"MANOHLA DARGIS","Review: ‘The Wave’ Is a Disaster Movie Making a Big Splash","Roar Uthaug’s disaster movie follows a family and others in a Norwegian village confronting a crumbling mountain and the cataclysm that follows.","2016-03-03","2016-03-04","2017-11-02 4:18",2016
"649",114,"Knight of Cups","R",0,"A. O. SCOTT","Review: In ‘Knight of Cups,’ a Writer’s Flesh Is Willing but His Spirit Is Weak","Starring Christian Bale, Terrence Malick’s film addresses the existential, and erotic, issues of a screenwriter in Los Angeles.","2016-03-03","2016-03-04","2017-11-02 4:18",2016
"650",115,"Whiskey Tango Foxtrot","R",0,"NICOLAS RAPOLD","Review: In ‘Whiskey Tango Foxtrot,’ Tina Fey as a Wisecracking War Reporter","Based on Kim Barker’s memoir, “The Taliban Shuffle,” the comedy depicts the battle-tested experience of a journalist in Afghanistan.","2016-03-03","2016-03-04","2017-11-02 4:18",2016
"651",116,"Emelie","",0,"MANOHLA DARGIS","Review: In ‘Emelie,’ Don’t Tell Mom the Babysitter’s Deadly","In this horror film directed by Michael Thelin, a girl hired to mind the children in a household turns out to be a dire threat to them.","2016-03-03","2016-03-04","2017-11-02 4:18",2016
"652",117,"Glassland","",0,"STEPHEN HOLDEN","Review: ‘Glassland,’ the Brittle Territory of Love and Addiction","Alcohol is a dependable friend for a woman (Toni Collette) who has been abandoned and disappointed by life and has let others down in turn.","2016-02-11","2016-03-18","2017-11-02 4:18",2016
"653",118,"Wrestling Jerusalem","",0,"KEN JAWOROWSKI","Review: In ‘Wrestling Jerusalem,’ One Man Gives Voice to Many","In a movie adapted from his play, the writer and actor Aaron Davidman portrays more than a dozen people affected by the Mideast conflict.","2017-09-12","2016-04-01","2017-11-02 4:18",2016
"654",119,"Maurizio Cattelan: Be Right Back","",0,"KEN JAWOROWSKI","Review: ‘Maurizio Cattelan: Be Right Back’ Relishes a Mischievous Artist","The documentary explores the artworks and pranks of an Italian trickster.","2017-04-13","2016-04-01","2017-11-02 4:18",2016
"655",120,"Baaghi","",0,"RACHEL SALTZ","Review: ‘Baaghi,’ a Bollywood Rebel Tale in Search of a Cause","Fists and feet fly in this movie with the usual grab bag of romance, comedy and drama, directed by Sabbir Khan and starring Tiger Shroff and Shraddha Kapoor.","2016-05-01","2016-04-29","2017-11-02 4:18",2016
"656",121,"Older Than Ireland","",1,"ANDY WEBSTER","Review: In ‘Older Than Ireland,’ Centenarians Recall Early and Latter Days","Thirty wry old-timers are impressive raconteurs in this documentary directed by Alex Fegan, released during the centenary of the Easter Rising.","2016-04-28","2016-04-29","2017-11-02 4:18",2016
"657",122,"Viva","R",1,"STEPHEN HOLDEN","Review: In ‘Viva,’ a Star Is Waiting to Be Born","A macho father released from prison decides to move in with the son he abandoned, who is a sweet-natured gay hairdresser and an aspiring drag queen.","2016-04-28","2016-04-29","2017-11-02 4:18",2016
"658",123,"The Man Who Knew Infinity","PG-13",0,"ANDY WEBSTER","Review: ‘The Man Who Knew Infinity’ Gives a Mathematical Genius His Due","This film centers on Srinivasa Ramanujan, a brilliant mathematician from India, and his unlikely friendship with the Cambridge professor G.H. Hardy.","2016-04-28","2016-04-29","2017-11-02 4:18",2016
"659",124,"A Beautiful Planet","G",0,"KEN JAWOROWSKI","Review: ‘A Beautiful Planet’ Shows a Dazzling Earth From Space","Images of the planet, and even mundane tasks, take on a fascinating quality in this documentary shot by astronauts aboard the International Space Station.","2016-04-28","2016-04-29","2017-11-02 4:18",2016
"660",125,"Bourek","",0,"JEANNETTE CATSOULIS","Review: ‘Bourek,’ About a Group of Drifting Souls","Assorted characters on an island bicker and lounge against a backdrop of news reports heralding social and financial catastrophe.","2016-04-28","2016-04-29","2017-11-02 4:18",2016
"661",126,"Dough","",0,"NEIL GENZLINGER","Review: ‘Dough,’ a Sweet but Pat Tale of Bridging Religious and Racial Differences","Jonathan Pryce and Jerome Holder star in this feature about an elderly Jewish baker in London who ends up hiring a young black Muslim as his assistant.","2016-04-28","2016-04-29","2017-11-02 4:18",2016
"662",127,"Mother’s Day","PG-13",0,"GLENN KENNY","Review: ‘Mother’s Day’ Is a Goopy, Glossy Sentimental Mess","Jennifer Aniston, Kate Hudson and Julia Roberts star in this holiday-themed film that generates inadvertent laughs and has predictable plotlines.","2016-04-28","2016-04-29","2017-11-02 4:18",2016
"663",128,"Papa: Hemingway in Cuba","R",0,"HELEN T. VERONGOS","Review: ‘Papa: Hemingway in Cuba,’ a Mild Voyage With the Old Man and ‘the Kid’","In Bob Yari’s autobiographical film, a young Miami journalist’s fan letter leads to a fishing trip and a long friendship with his literary hero.","2016-04-28","2016-04-29","2017-11-02 4:18",2016
"664",129,"Pali Road","",0,"NEIL GENZLINGER","Review: ‘Pali Road’ Blends Romance and Suspense","Although the acting can be wooden at times, ‘Pali Road’ is a decent film set in a gorgeous locale.","2016-04-28","2016-04-29","2017-11-02 4:18",2016
"665",130,"Ratchet & Clank","PG",0,"ANDY WEBSTER","Review: ‘Ratchet &amp; Clank,’ a Stale Tale Based on a PlayStation Game","The movie has little story to tell and few ideas to offer, but a great deal of product to sell.","2016-04-28","2016-04-29","2017-11-02 4:18",2016
"666",131,"Fassbinder: To Love Without Demands","",0,"STEPHEN HOLDEN","Review: Rainer Werner Fassbinder’s Intense World and His Films","A fellow filmmaker examines the work of this German director from the close perspective of friendship.","2016-04-28","2016-04-29","2017-11-02 4:18",2016
"667",132,"Keanu","R",0,"MANOHLA DARGIS","Review: In ‘Keanu,’ Key &amp; Peele Break Baddish for a Beloved Kitty","The duo star as hapless cousins who feign toughness to recover a pet from gang killers.","2016-04-28","2016-04-29","2017-11-02 4:18",2016
"668",133,"Eva Hesse","",1,"A. O. SCOTT","Review: ‘Eva Hesse’ Offers a Moving Portrait of an Artist’s Brief Life","Marcie Begleiter’s documentary explores the originality and power of Hesse, who managed to triumph in a male-dominated art world before dying at 34.","2016-04-26","2016-04-27","2017-11-02 4:18",2016
"669",134,"A Hologram for the King","R",1,"STEPHEN HOLDEN","Review: ‘A Hologram for the King’ Is Elevated by Tom Hanks’s Portrayal of an American Everyman","Set in Saudi Arabia, this subdued absurdist farce reflects on American decline and runaway technology.","2016-04-21","2016-04-22","2017-11-02 4:18",2016
"670",135,"The Meddler","PG-13",1,"MANOHLA DARGIS","Review: In ‘The Meddler,’ a Yakkety Mom Comes of (a Certain) Age","As a mother and daughter, Susan Sarandon and Rose Byrne portray a mother-daughter relationship that grows up.","2016-04-21","2016-04-22","2017-11-02 4:18",2016
"671",136,"Hockney","",0,"STEPHEN HOLDEN","Review: Basking in an Artist’s Sun in ‘Hockney’ Documentary","This sunny film, with occasional clouds, looks at David Hockney’s life, his losses and his work’s reflections of his immersion in Southern California.","2016-04-21","2016-04-22","2017-11-02 4:18",2016
"672",137,"Compadres","",0,"NEIL GENZLINGER","Review: ‘Compadres,’ a Cross-Border Buddy Film","A former Mexican police officer tracking down crime syndicate loot forms an alliance with a young American hacker who played a small role in moving it.","2016-04-21","2016-04-22","2017-11-02 4:18",2016
"673",138,"Love Thy Nature","",0,"NEIL GENZLINGER","Review: In ‘Love Thy Nature,’ It Takes a Planet","Sylvie Rokab’s film, narrated by Liam Neeson, advocates redefining the relationship between humans and the natural world.","2016-04-21","2016-04-22","2017-11-02 4:18",2016
"674",139,"Men & Chicken","",0,"GLENN KENNY","Review: ‘Men &amp; Chicken,’ a Gory and Quirky Danish Comedy","Two brothers trek to a remote island to find their biological father, and slapstick violence ensues.","2016-04-21","2016-04-22","2017-11-02 4:18",2016
"675",140,"We the People","",0,"HELEN T. VERONGOS","Review: A Grocery Chain, a Family Feud and a Win for Ordinary People","This documentary, bursting with real-life superheroes who drive trucks and bag groceries, recounts the Market Basket uprising.","2016-04-21","2016-04-15","2017-11-02 4:18",2016
"676",141,"Nina","",0,"A. O. SCOTT","Review: Casting ‘Nina’ Was Controversial, but Is It a Good Movie?","This biopic of Nina Simone was criticized for its choice of Zoe Saldana in the title role, but its problems are greater than that.","2016-04-21","2016-04-22","2017-11-02 4:18",2016
"677",142,"Elvis & Nixon","R",0,"MANOHLA DARGIS","Review: In ‘Elvis &amp; Nixon,’ Michael Shannon Holds Court as the King","The director Liza Johnson recreates the meeting between the singer and the president, to which each brought his own agenda.","2016-04-21","2016-04-22","2017-11-02 4:18",2016
"678",143,"The Huntsman: Winter’s War","PG-13",0,"A. O. SCOTT","Review: ‘The Huntsman,’ a Study in Hollywood’s Overstuffed Playbook","Every resonant theme in this de-imaging of a fairy tale is stripped away, replaced with a ready-made franchise-movie conceit.","2016-04-21","2016-04-22","2017-11-02 4:18",2016
"679",144,"How to Let Go of the World and Love All the Things Climate Can’t Change","",0,"KEN JAWOROWSKI","Review: ‘How to Let Go of the World’ Ups the Ante on Climate Change","Josh Fox, the director of “Gasland,” returns with this documentary that takes a tough look at climate change — including projected catastrophes.","2016-04-19","2016-04-20","2017-11-02 4:18",2016
"680",145,"13 Cameras","",1,"NEIL GENZLINGER","Review: ‘13 Cameras,’ Keeping a Watchful Eye and Then Some","A creepy landlord, a father-to-be with a wandering eye, and a lot more than a couple bargained for in renting a home.","2016-04-14","2016-04-15","2017-11-02 4:18",2016
